Time,Event,Location,Units,Date,Datetime
7:17 pm,OUTSIDE FIRE,5500 BLOCK UPSHUR SQ,Units: E311,05/08/2024,2024-05-08 19:17:00
6:35 pm,VEHICLE ACCIDENT - ROLLOVER,NEW DESIGN RD / STADIUM DR,"Units: E311, R2, A318, ALS31, BC901, EMS901, FS03",05/08/2024,2024-05-08 18:35:00
6:14 pm,WIRES DOWN OR ARCING,OPOSSUMTOWN PIKE / AMBER DR,"Units: PE23, FS29",05/08/2024,2024-05-08 18:14:00
5:51 pm,GAS LEAK INSIDE,5600 BLOCK QUEEN ANNE CT,Units: CMD15,05/08/2024,2024-05-08 17:51:00
5:46 pm,GAS LEAK INSIDE,5600 BLOCK QUEEN ANNE CT,"Units: E153, E331, R15",05/08/2024,2024-05-08 17:46:00
5:41 pm,GAS LEAK OUTSIDE,7100 BLOCK AUTUMN LEAF LN,Units: E291,05/08/2024,2024-05-08 17:41:00
5:21 pm,VEHICLE ACCIDENT - ALS,"TENNISON DR / MARSDEN PL, CELL TOWER TUSCARORA HIGH SCHOOL","Units: A318, ALS31, PE311, EMS901",05/08/2024,2024-05-08 17:21:00
4:24 pm,UNKNOWN ODOR INSIDE,"100 BLOCK THOMAS JOHNSON DR, Apt/Unit:180, ATHLETIC CLINIC",Units: CMD29,05/08/2024,2024-05-08 16:24:00
4:20 pm,COMMERCIAL FIRE ALARM,"200 BLOCK S MAPLE AVE, 84 LUMBER BRUNSWICK",Units: TW1,05/08/2024,2024-05-08 16:20:00
4:16 pm,COMMERCIAL FIRE ALARM,"200 BLOCK S MAPLE AVE, 84 LUMBER BRUNSWICK",Units: RE52,05/08/2024,2024-05-08 16:16:00
4:15 pm,COMMERCIAL FIRE ALARM,9200 BLOCK WILLAMETTE PL,Units: E232,05/08/2024,2024-05-08 16:15:00
4:14 pm,COMMERCIAL FIRE ALARM,"200 BLOCK S MAPLE AVE, 84 LUMBER BRUNSWICK",Units: T5,05/08/2024,2024-05-08 16:14:00
4:13 pm,UNKNOWN ODOR INSIDE,"100 BLOCK THOMAS JOHNSON DR, Apt/Unit:180, RED CROSS FREDERICK","Units: E291, E23, R2, FS29",05/08/2024,2024-05-08 16:13:00
1:50 pm,COMMERCIAL FIRE ALARM,"3300 BLOCK GALENA DR, URBAN GREEN APARTMENTS","Units: E251, FS23",05/08/2024,2024-05-08 13:50:00
11:49 am,COMMERCIAL FIRE ALARM,"5600 BLOCK BUCKEYSTOWN PIKE, CHURCH OF THE REDEEMER","Units: PE311, TW4",05/08/2024,2024-05-08 11:49:00
7:35 am,WIRES DOWN OR ARCING,"900 BLOCK E C ST, BRUNSWICK RESERVOIR",Units: BR55,05/08/2024,2024-05-08 07:35:00
7:25 am,VEHICLE ACCIDENT - BLS,"I270SB / MONTGOMERY COUNTY LINE, I270SB / MONTGOMERY COUNTY LINE","Units: E232, R2, A239",05/08/2024,2024-05-08 07:25:00
4:06 am,COMMERCIAL FIRE ALARM,5000 BLOCK BUCKEYSTOWN PIKE,"Units: PE311, TW4",05/08/2024,2024-05-08 04:06:00
1:46 am,ELECTRICAL HAZARD INSIDE,1300 BLOCK HAMPSHIRE DR,"Radio: 9C Units: E501, TW1",05/08/2024,2024-05-08 01:46:00
1:45 am,ELECTRICAL HAZARD INSIDE,1300 BLOCK HAMPSHIRE DR,Radio: 9C Units: E11,05/08/2024,2024-05-08 01:45:00
10:59 pm,VEHICLE ACCIDENT - ENTRAPMENT,"RT15NB / BIGGS FORD RD, RT15NB / BIGGS FORD RD",Radio: 9D Units: CMD29,05/07/2024,2024-05-07 22:59:00
10:57 pm,VEHICLE ACCIDENT - ENTRAPMENT,"RT15NB / BIGGS FORD RD, RT15NB / BIGGS FORD RD",Radio: 9D Units: CMD29,05/07/2024,2024-05-07 22:57:00
10:46 pm,VEHICLE ACCIDENT - ENTRAPMENT,"RT15NB / BIGGS FORD RD, RT15NB / BIGGS FORD RD","Radio: 9D Units: E291, R20, A299, ALS29, BC902, EMS902",05/07/2024,2024-05-07 22:46:00
10:41 pm,UNKNOWN ODOR INSIDE,900 BLOCK CHEROKEE TRL,"Units: PE23, E31, R2",05/07/2024,2024-05-07 22:41:00
9:58 pm,COMMERCIAL FIRE ALARM,"4000 BLOCK ROCK HALL RD, BUILDERS FIRST SOURCE POINT OF ROCKS","Units: E281, T5",05/07/2024,2024-05-07 21:58:00
8:55 pm,VEHICLE ACCIDENT - ENTRAPMENT,"5700 BLOCK MAGNOLIA TREE CT, MOUNTAIN GLEN APTS","Radio: 9D Units: PE311, R2, A318, ALS31, BC901, EMS901",05/07/2024,2024-05-07 20:55:00
8:36 pm,APPLIANCE FIRE CONTAINED,"100 BLOCK DEPAUL ST, Apt/Unit:A3, SCHOOLHOUSE APTS",Units: CMD6,05/07/2024,2024-05-07 20:36:00
8:31 pm,APPLIANCE FIRE CONTAINED,"100 BLOCK DEPAUL ST, Apt/Unit:A3, SCHOOLHOUSE APTS",Units: R6,05/07/2024,2024-05-07 20:31:00
8:27 pm,APPLIANCE FIRE CONTAINED,"100 BLOCK DEPAUL ST, Apt/Unit:A3, SCHOOLHOUSE APTS","Units: E61, E102, ACE232",05/07/2024,2024-05-07 20:27:00
7:57 pm,COMMERCIAL FIRE ALARM,"5200 BLOCK PRESIDENTS CT, JIMMY JOHNS",Units: PE311,05/07/2024,2024-05-07 19:57:00
6:43 pm,VEHICLE ACCIDENT - BLS,"I270NB / SCENIC OVERLOOK, I270NB / SCENIC OVERLOOK","Units: E232, E31, R2, A239, A318",05/07/2024,2024-05-07 18:43:00
6:05 pm,VEHICLE ACCIDENT - ALS,OLD FREDERICK RD / LINKS BRIDGE RD,Units: BC902,05/07/2024,2024-05-07 18:05:00
6:03 pm,VEHICLE ACCIDENT - ALS,OLD FREDERICK RD / LINKS BRIDGE RD,"Units: A229, ALS30, E162, EMS902",05/07/2024,2024-05-07 18:03:00
5:48 pm,COMMERCIAL FIRE ALARM,"5200 BLOCK PRESIDENTS CT, JCR WESTVIEW CORNER",Units: PE311,05/07/2024,2024-05-07 17:48:00
5:31 pm,COMMERCIAL FIRE ALARM,"5200 BLOCK PRESIDENTS CT, WINE DISTRICTS","Units: PE311, TW4",05/07/2024,2024-05-07 17:31:00
4:34 pm,CHECK UP AFTER ACCIDENT - POLICE ON SCENE,"1600 BLOCK ROSEMONT AVE, SHEETZ ROSEMONT","Units: A19, E11",05/07/2024,2024-05-07 16:34:00
4:30 pm,COMMERCIAL FIRE ALARM,"5200 BLOCK PRESIDENTS CT, JCR WESTVIEW CORNER, SL","Units: PE311, TW4",05/07/2024,2024-05-07 16:30:00
3:44 pm,VEHICLE ACCIDENT - BLS,WORMANS MILL RD / MILL POND RD,Units: R2,05/07/2024,2024-05-07 15:44:00
3:39 pm,VEHICLE ACCIDENT - BLS,WORMANS MILL RD / MILL POND RD,"Units: A247, A29, PE23, FS29",05/07/2024,2024-05-07 15:39:00
2:34 pm,COMMERCIAL FIRE ALARM,"2100 BLOCK WHITTIER DR, SOMERFORD PLACE","Units: E11, TW4",05/07/2024,2024-05-07 14:34:00
12:10 pm,ELECTRICAL HAZARD - INVESTIGATION,100 BLOCK W ALL SAINTS ST,Units: E31,05/07/2024,2024-05-07 12:10:00
10:44 am,COMMERCIAL FIRE ALARM,100 BLOCK HAMILTON AVE,"Units: E31, TW4",05/07/2024,2024-05-07 10:44:00
10:18 am,FLOODING CONDITION,100 BLOCK W ALL SAINTS ST,Units: R2,05/07/2024,2024-05-07 10:18:00
10:14 am,FLOODING CONDITION,100 BLOCK W ALL SAINTS ST,Units: E31,05/07/2024,2024-05-07 10:14:00
9:36 am,VEHICLE FIRE,W FOURTEENTH ST / MOTTER AVE,Units: E23,05/07/2024,2024-05-07 09:36:00
1:20 am,CHECK UP AFTER ACCIDENT - POLICE ON SCENE,"OLD ANNAPOLIS RD / KIMMEL RD, Apt/Unit:A",Units: A158,05/07/2024,2024-05-07 01:20:00
1:13 am,CHECK UP AFTER ACCIDENT - POLICE ON SCENE,"OLD ANNAPOLIS RD / KIMMEL RD, Apt/Unit:A","Units: A179, R15",05/07/2024,2024-05-07 01:13:00
1:09 am,VEHICLE FIRE,800 BLOCK E POTOMAC ST,"Units: RE52, A196",05/07/2024,2024-05-07 01:09:00
12:44 am,FUEL SPILL,"RT340EB / RT180 (FREDERICK), RT15NB / W PATRICK ST",Radio: 9C Units: CMD31,05/07/2024,2024-05-07 00:44:00
12:16 am,FUEL SPILL,"RT340EB / RT180 (FREDERICK), RT15NB / W PATRICK ST",Radio: 9C Units: HM33,05/07/2024,2024-05-07 00:16:00
12:04 am,FUEL SPILL,"RT340EB / RT180 (FREDERICK), RT15NB / W PATRICK ST","Units: E31, PE311",05/07/2024,2024-05-07 00:04:00
10:10 pm,COMMERCIAL FIRE ALARM,"800 BLOCK STRATFORD WAY, Apt/Unit:F","Radio: 9C Units: E31, TW4, FS02",05/06/2024,2024-05-06 22:10:00
9:36 pm,VEHICLE ACCIDENT - ALS,8900 BLOCK ORNDORFF RD,"Radio: 9B Units: ALS30, EMS902",05/06/2024,2024-05-06 21:36:00
9:35 pm,VEHICLE ACCIDENT - BLS,8900 BLOCK ORNDORFF RD,Radio: 9B Units: EK64,05/06/2024,2024-05-06 21:35:00
9:35 pm,VEHICLE ACCIDENT - BLS,8900 BLOCK ORNDORFF RD,Radio: 9B Units: CMD6,05/06/2024,2024-05-06 21:35:00
9:33 pm,VEHICLE ACCIDENT - BLS,8900 BLOCK ORNDORFF RD,Radio: 9B Units: E61,05/06/2024,2024-05-06 21:33:00
9:27 pm,VEHICLE ACCIDENT - BLS,8900 BLOCK ORNDORFF RD,Radio: 9B Units: R6,05/06/2024,2024-05-06 21:27:00
9:22 pm,VEHICLE ACCIDENT - BLS,8900 BLOCK ORNDORFF RD,"Radio: 9B Units: A69, EK64",05/06/2024,2024-05-06 21:22:00
3:30 pm,ODOR OF SMOKE INSIDE,"5000 BLOCK BUCKEYSTOWN PIKE, TMOBILE","Units: PE311, E31, TW4",05/06/2024,2024-05-06 15:30:00
2:54 pm,COMMERCIAL FIRE ALARM,"2500 BLOCK HEMINGWAY DR, RIDGEVIEW CONDOS",Units: E11,05/06/2024,2024-05-06 14:54:00
1:34 pm,VEHICLE FIRE REPORTED OUT,"7300 BLOCK EXECUTIVE WAY, SHEETZ EXECUTIVE",Units: E311,05/06/2024,2024-05-06 13:34:00
11:03 am,COMMERCIAL FIRE ALARM,"500 BLOCK LEAHY CT, Apt/Unit:K, BUCKINGHAM CONDOS","Units: PE311, TW1",05/06/2024,2024-05-06 11:03:00
10:16 am,COMMERCIAL FIRE ALARM,"2500 BLOCK HEMINGWAY DR, RIDGEVIEW CONDOS",Units: E11,05/06/2024,2024-05-06 10:16:00
3:52 am,COMMERCIAL FIRE ALARM,"7200 BLOCK CORPORATE CT, HILTON GARDEN INN","Radio: 9C Units: PE311, TW4",05/06/2024,2024-05-06 03:52:00
2:14 am,VEHICLE FIRE,I70EB / 38MM,Radio: PS1 Units: E82,05/06/2024,2024-05-06 02:14:00
1:58 am,COMMERCIAL FIRE ALARM,100 BLOCK E SOUTH ST,"Units: E31, TW4",05/06/2024,2024-05-06 01:58:00
10:28 pm,SHOOTING,"100 BLOCK E PATRICK ST, CITIZENS BALLROOM","Units: A38, PE23, E31, BC901, EMS901",05/05/2024,2024-05-05 22:28:00
8:39 pm,COMMERCIAL FIRE ALARM,"100 BLOCK N MARKET ST, BREWERS ALLEY","Units: E31, TW4",05/05/2024,2024-05-05 20:39:00
8:22 pm,MOTORCYCLE ACCIDENT,100 BLOCK THOMAS JOHNSON DR,"Units: A299, ALS29, E291, EMS902, FS29",05/05/2024,2024-05-05 20:22:00
7:52 pm,FLOODING CONDITION,"3200 BLOCK BAKER CIR, Apt/Unit:3207, BUCKINGHAMS CHOICE",Units: R14,05/05/2024,2024-05-05 19:52:00
7:15 pm,FLOODING CONDITION,"3200 BLOCK BAKER CIR, Apt/Unit:3207, BUCKINGHAMS CHOICE",Units: E141,05/05/2024,2024-05-05 19:15:00
6:04 pm,COMMERCIAL FIRE ALARM,"4000 BLOCK ROCK HALL RD, BUILDERS FIRST SOURCE",Radio: 9C Units: Q28,05/05/2024,2024-05-05 18:04:00
6:01 pm,COMMERCIAL FIRE ALARM,"4000 BLOCK ROCK HALL RD, BUILDERS FIRST SOURCE","Units: E141, T5, FS28",05/05/2024,2024-05-05 18:01:00
5:47 pm,VEHICLE ACCIDENT - ALS,8700 BLOCK GREEN VALLEY RD,Units: CMD17,05/05/2024,2024-05-05 17:47:00
5:40 pm,VEHICLE ACCIDENT - ALS,8700 BLOCK GREEN VALLEY RD,"Units: A179, ALS17, E172, EMS902",05/05/2024,2024-05-05 17:40:00
4:55 pm,VEHICLE FIRE,"RT340WB / 11MM, RT340WB / 11MM","Radio: 9C Units: E31, E201",05/05/2024,2024-05-05 16:55:00
4:39 pm,RESIDENTIAL FIRE ALARM (SINGLE FAMILY RESD/ MOBILE HOME),5600 BLOCK ZOE LN,Units: E331,05/05/2024,2024-05-05 16:39:00
3:23 pm,SERVICE CALL,"200 BLOCK DILL AVE, BANNER SCHOOL",Units: R2,05/05/2024,2024-05-05 15:23:00
3:20 pm,SERVICE CALL,"200 BLOCK DILL AVE, BANNER SCHOOL",Units: PE23,05/05/2024,2024-05-05 15:20:00
1:48 pm,MUTUAL AID,200 BLOCK BOYLE RD,Units: A158,05/05/2024,2024-05-05 13:48:00
1:03 pm,VEHICLE ACCIDENT - ENTRAPMENT,SOUTH ST / WALNUT ST,"Radio: 91D Units: E172, R15, A179, ALS17, BC902, EMS902",05/05/2024,2024-05-05 13:03:00
10:31 am,VEHICLE ACCIDENT - ALS,"LIBERTY RD / MONOCACY BLVD, WALMART","Units: ALS2, EMS902",05/05/2024,2024-05-05 10:31:00
10:31 am,VEHICLE ACCIDENT - ALS,"LIBERTY RD / MONOCACY BLVD, WALMART",Units: E23,05/05/2024,2024-05-05 10:31:00
10:28 am,VEHICLE ACCIDENT - BLS,"2400 BLOCK MONOCACY BLVD, WALMART","Units: A247, A29, E291, FS29",05/05/2024,2024-05-05 10:28:00
9:48 am,RESIDENTIAL FIRE ALARM (SINGLE FAMILY RESD/ MOBILE HOME),6900 BLOCK MANDALONG WAY,Radio: 9C Units: E152,05/05/2024,2024-05-05 09:48:00
9:13 am,CHECK UP AFTER ACCIDENT - POLICE ON SCENE,5700 BLOCK TOBERY RD,"Units: A339, E331",05/05/2024,2024-05-05 09:13:00
8:54 am,COMMERCIAL FIRE ALARM,9100 BLOCK KENWAY LN,Radio: 9C Units: E232,05/05/2024,2024-05-05 08:54:00
7:40 am,CHECK UP AFTER ACCIDENT - POLICE ON SCENE,5900 BLOCK MEADOW RD,"Radio: 9B Units: A339, E331",05/05/2024,2024-05-05 07:40:00
7:06 am,UNIT TRANSFER TO OTHER STATION,"100 BLOCK W MAIN ST, STATION 6",Units: A158,05/05/2024,2024-05-05 07:06:00
4:34 am,RESIDENTIAL FIRE ALARM (SINGLE FAMILY RESD/ MOBILE HOME),200 BLOCK GALYN DR,Radio: 9C Units: RE52,05/05/2024,2024-05-05 04:34:00
4:22 am,VEHICLE ACCIDENT - ALS,HILLCREST DR / ARWELL CT,"Radio: 9B Units: PE23, EMS901",05/05/2024,2024-05-05 04:22:00
4:14 am,VEHICLE ACCIDENT - BLS,"1200 BLOCK HILLCREST DR, HILLCREST ELEMENTARY SCHOOL",Radio: 9B Units: E11,05/05/2024,2024-05-05 04:14:00
4:06 am,VEHICLE ACCIDENT - BLS,"1200 BLOCK HILLCREST DR, HILLCREST ELEMENTARY SCHOOL","Radio: 9B Units: A18, TW4",05/05/2024,2024-05-05 04:06:00
11:35 pm,VEHICLE ACCIDENT - ALS,PETERSVILLE RD / BURKITTSVILLE RD,"Radio: 9D Units: A196, ALS20, RE52, EMS901",05/04/2024,2024-05-04 23:35:00
11:11 pm,RESIDENTIAL FIRE ALARM (SINGLE FAMILY RESD/ MOBILE HOME),2800 BLOCK IVY MEADOW CT,Radio: 9C Units: E232,05/04/2024,2024-05-04 23:11:00
10:55 pm,VEHICLE ACCIDENT - BLS,"I70EB / 48MM, I70EB / 48MM",Radio: 9B Units: RE74,05/04/2024,2024-05-04 22:55:00
10:53 pm,VEHICLE ACCIDENT - BLS,"I70EB / 48MM, I70EB / 48MM","Units: E72, E121, R8, A89",05/04/2024,2024-05-04 22:53:00
9:58 pm,COMMERCIAL FIRE ALARM,"5200 BLOCK BUCKEYSTOWN PIKE, FIREBIRDS WOOD FIRED GRILL","Radio: 9C Units: PE311, TW4",05/04/2024,2024-05-04 21:58:00
9:44 pm,VEHICLE ACCIDENT - BLS,"2400 BLOCK MONOCACY BLVD, GLADE VALLEY ANIMAL HOSPITAL","Units: A247, A299, E291",05/04/2024,2024-05-04 21:44:00
9:34 pm,VEHICLE ACCIDENT - ROLLOVER,KEMP LN / SHOOKSTOWN RD,"Radio: 9D Units: E11, R2, A19, ALS2, EMS902",05/04/2024,2024-05-04 21:34:00
8:27 pm,VEHICLE FIRE,100 BLOCK W HAMMAKER ST,Radio: 9C Units: CMD10,05/04/2024,2024-05-04 20:27:00
8:18 pm,VEHICLE FIRE,100 BLOCK W HAMMAKER ST,"Radio: 9C Units: E102, E132, EK224, Q11, A309, BR106, BC902, SAF901, FS10",05/04/2024,2024-05-04 20:18:00
7:13 pm,RESIDENTIAL FIRE ALARM (SINGLE FAMILY RESD/ MOBILE HOME),100 BLOCK E MAIN ST,Radio: 9C Units: E61,05/04/2024,2024-05-04 19:13:00
6:18 pm,VEHICLE ACCIDENT - ROLLOVER,3800 BLOCK GREEN VALLEY RD,"Units: E251, R15, A259, BC901, EMS902",05/04/2024,2024-05-04 18:18:00
5:41 pm,WIRES DOWN OR ARCING,"200 BLOCK E SECOND ST, FREDERICK VISITATION ACADEMY",Radio: 9C Units: E31,05/04/2024,2024-05-04 17:41:00
5:39 pm,WIRES DOWN OR ARCING,"200 BLOCK E SECOND ST, FREDERICK VISITATION ACADEMY",Radio: 9C Units: BR35,05/04/2024,2024-05-04 17:39:00
5:15 pm,WIRES DOWN OR ARCING,6400 BLOCK LINGANORE RD,Radio: 9C Units: E331,05/04/2024,2024-05-04 17:15:00
5:01 pm,VEHICLE ACCIDENT - BLS,"I70WB / RT40A(BRADDOCK), I70WB / RT40A","Units: E11, E82, RE74, A19, A89",05/04/2024,2024-05-04 17:01:00
4:40 pm,VEHICLE ACCIDENT - BLS,URBANA PIKE / GROVE RD,"Radio: 9B Units: A38, E31",05/04/2024,2024-05-04 16:40:00
2:54 pm,COMMERCIAL FIRE ALARM,100 BLOCK E THIRD ST,"Radio: 9C Units: E31, TW4",05/04/2024,2024-05-04 14:54:00
2:17 pm,VEHICLE ACCIDENT - HIGH MECHANISM - ALS,URBANA PIKE / MOTT RD,"Units: E232, R15, A259, BC901, EMS902",05/04/2024,2024-05-04 14:17:00
2:08 pm,SHOOTING,2900 BLOCK WARD KLINE RD,"Radio: 9D Units: E82, C8",05/04/2024,2024-05-04 14:08:00
2:06 pm,SHOOTING,2900 BLOCK WARD KLINE RD,"Radio: 9D Units: A89, ALS8, R8, EMS901",05/04/2024,2024-05-04 14:06:00
1:56 pm,VEHICLE ACCIDENT - BLS,"300 BLOCK N EAST ST, ROSEDALE ICE COMPANY",Radio: 9B Units: R2,05/04/2024,2024-05-04 13:56:00
1:54 pm,VEHICLE ACCIDENT - BLS,"300 BLOCK N EAST ST, ROSEDALE ICE COMPANY","Radio: 9B Units: A29, PE23",05/04/2024,2024-05-04 13:54:00
1:39 pm,COMMERCIAL FIRE ALARM,"800 BLOCK BLAKELY CT, Apt/Unit:347, CRYSTAL PARK APTS",Units: TW4,05/04/2024,2024-05-04 13:39:00
1:36 pm,VEHICLE ACCIDENT - ALS,15100 BLOCK SABILLASVILLE RD,Units: EMS902,05/04/2024,2024-05-04 13:36:00
1:35 pm,VEHICLE ACCIDENT - ALS,15100 BLOCK SABILLASVILLE RD,"Units: A309, ALS30, R10, EMS901",05/04/2024,2024-05-04 13:35:00
1:30 pm,COMMERCIAL FIRE ALARM,"800 BLOCK BLAKELY CT, Apt/Unit:347, CRYSTAL PARK APTS","Radio: 9C Units: E11, TW4",05/04/2024,2024-05-04 13:30:00
1:29 pm,VEHICLE ACCIDENT - ALS,"RT144 / QUINN ORCHARD RD, RT144 / QUINN ORCHARD RD","Radio: 9D Units: A39, PE23, E331, EMS902",05/04/2024,2024-05-04 13:29:00
12:22 pm,VEHICLE FIRE,"I70EB / 59MM, I70EB / LINGANORE RD",Units: K33,05/04/2024,2024-05-04 12:22:00
12:22 pm,VEHICLE FIRE,"I70EB / 59MM, I70EB / LINGANORE RD","Units: E331, FS33, E152, A339",05/04/2024,2024-05-04 12:22:00
10:54 am,MUTUAL AID,FRANCIS SCOTT KEY HWY / MIDDLEBURG RD,Units: E91,05/04/2024,2024-05-04 10:54:00
10:52 am,MUTUAL AID,FRANCIS SCOTT KEY HWY / MIDDLEBURG RD,Units: SU9,05/04/2024,2024-05-04 10:52:00
10:32 am,ILLEGAL OPEN BURNING - NON EMERGENCY RESPONSE,8900 BLOCK LONGS MILL RD,Radio: 9C Units: BR136,05/04/2024,2024-05-04 10:32:00
7:20 am,COMMERCIAL FIRE ALARM,"600 BLOCK HIMES AVE, LA PETITE ACADEMY","Units: E11, TW4",05/04/2024,2024-05-04 07:20:00
1:20 am,VEHICLE ACCIDENT - BLS,5900 BLOCK ELMER DERR RD,"Units: A318, PE311",05/04/2024,2024-05-04 01:20:00
10:06 pm,OUTSIDE FIRE,LEGORE BRIDGE RD / LEGORE RD,Radio: 9C Units: BR96,05/03/2024,2024-05-03 22:06:00
9:58 pm,VEHICLE ACCIDENT - ALS,100 BLOCK E FOURTH ST,Radio: 9D Units: CMD2,05/03/2024,2024-05-03 21:58:00
9:53 pm,VEHICLE ACCIDENT - ALS,100 BLOCK E FOURTH ST,"Units: A29, ALS2, PE23, EMS901",05/03/2024,2024-05-03 21:53:00
8:49 pm,BARN FIRE,"4800 BLOCK WHISKEY CT, WHISKEY CREEK GOLF CLUB","Units: E251, E232, E152, E331, E31, R15, TW4, K23, K33, A259, ALS23, BC901, SAF901, FS25",05/03/2024,2024-05-03 20:49:00
8:37 pm,OUTSIDE FIRE,COXEY BROWN RD / HARMONY RD,Radio: 9C Units: BR85,05/03/2024,2024-05-03 20:37:00
4:57 pm,VEHICLE ACCIDENT - BLS,"300 BLOCK PROSPECT BLVD, PUBLIC STORAGE","Units: A38, E31",05/03/2024,2024-05-03 16:57:00
4:07 pm,BRUSH FIRE,BALL RD / REELS MILL RD,Units: E232,05/03/2024,2024-05-03 16:07:00
3:39 pm,VEHICLE ACCIDENT - BLS,"RT85 / RT355, RT85 / RT355","Units: A39, E31",05/03/2024,2024-05-03 15:39:00
3:14 pm,VEHICLE ACCIDENT - ALS,"BALTIMORE NATIONAL PIKE PIKE / EASTERDAY RD, RT40 / EASTERDAY RD","Units: A89, ALS8, E82",05/03/2024,2024-05-03 15:14:00
1:37 pm,SERVICE CALL,"300 BLOCK BAUGHMANS LN, STATION 1",Units: E11,05/03/2024,2024-05-03 13:37:00
1:37 pm,MOTORCYCLE ACCIDENT,200 BLOCK N CARROLL ST,Units: E102,05/03/2024,2024-05-03 13:37:00
1:35 pm,MOTORCYCLE ACCIDENT,200 BLOCK N CARROLL ST,"Units: A309, ALS30, R10, EMS902",05/03/2024,2024-05-03 13:35:00
11:19 am,ELEVATOR MALFUNCTION,"400 BLOCK CENTRAL AVE, BRUNSWICK ELEMENTARY SCHOOL",Units: T5,05/03/2024,2024-05-03 11:19:00
10:27 am,VEHICLE ACCIDENT - ENTRAPMENT,WOODSBORO PIKE / LIBERTY RD,Radio: 9D Units: CMD16,05/03/2024,2024-05-03 10:27:00
10:20 am,RESIDENTIAL FIRE ALARM (SINGLE FAMILY RESD/ MOBILE HOME),100 BLOCK E THIRD ST,Units: E31,05/03/2024,2024-05-03 10:20:00
10:19 am,VEHICLE ACCIDENT - ROLLOVER,WOODSBORO PIKE / LIBERTY RD,"Radio: 9D Units: E162, R2, A169, ALS17, BC902, EMS902",05/03/2024,2024-05-03 10:19:00
9:42 am,FIRE ALARM SPECIFY,6000 BLOCK WALLEYE PL,"Radio: 9C Units: E331, FS15",05/03/2024,2024-05-03 09:42:00
9:18 am,ELEVATOR MALFUNCTION,"900 BLOCK W PATRICK ST, MOTEL 6",Units: TW4,05/03/2024,2024-05-03 09:18:00
8:23 am,UNIT TRANSFER TO OTHER STATION,"12400 BLOCK WOLFSVILLE RD, STATION 21",Units: E153,05/03/2024,2024-05-03 08:23:00
6:45 am,COMMERCIAL FIRE ALARM,"1000 BLOCK W PATRICK ST, FREDERICK COUNTY SQUARE","Units: E11, TW4",05/03/2024,2024-05-03 06:45:00
6:11 am,HOUSE FIRE,2200 BLOCK JEFFERSON PIKE,Units: E72,05/03/2024,2024-05-03 06:11:00
6:09 am,HOUSE FIRE,2200 BLOCK JEFFERSON PIKE,"Units: E201, RE52, Q28, E11, E31, R20, T5, R19, EK204, K5, K1, A209, ALS20, BC902, SAF901",05/03/2024,2024-05-03 06:09:00
6:07 am,OUTSIDE FIRE,JEFFERSON PIKE / PETERSVILLE RD,Units: BR55,05/03/2024,2024-05-03 06:07:00
5:21 am,UNKNOWN ODOR INSIDE,"2500 BLOCK SHELLEY CIR 2B, Apt/Unit:2B","Radio: 9C Units: E11, E501",05/03/2024,2024-05-03 05:21:00
2:21 am,SERVICE CALL,"400 BLOCK E PATRICK ST, Apt/Unit:E",Radio: 9C Units: E31,05/03/2024,2024-05-03 02:21:00
12:35 am,VEHICLE ACCIDENT - ALS,"4100 BLOCK BUCKEYSTOWN PIKE, VULCAN MATERIALS CO","Radio: 9D Units: A318, ALS31, PE311, EMS901",05/03/2024,2024-05-03 00:35:00
10:03 pm,APPLIANCE MALFUNCTION,"600 BLOCK N BENTZ ST, Apt/Unit:302, WATER TOWER VERNON AVE","Units: PE23, E31, R2",05/02/2024,2024-05-02 22:03:00
9:15 pm,GAS LEAK INSIDE,100 BLOCK NORTH POINTE TER,Radio: 9C Units: R20,05/02/2024,2024-05-02 21:15:00
9:09 pm,GAS LEAK INSIDE,100 BLOCK NORTH POINTE TER,"Radio: 9C Units: E72, E82, RE74",05/02/2024,2024-05-02 21:09:00
7:54 pm,WIRES DOWN OR ARCING,12000 BLOCK FINGERBOARD RD,Radio: 9C Units: E251,05/02/2024,2024-05-02 19:54:00
7:44 pm,VEHICLE ACCIDENT - BLS,BAUGHMANS LN / W PATRICK ST,"Radio: 9B Units: A18, E11",05/02/2024,2024-05-02 19:44:00
6:50 pm,VEHICLE ACCIDENT - BLS,2200 BLOCK WETHERBURNE WAY,"Radio: 9B Units: A299, E291",05/02/2024,2024-05-02 18:50:00
5:44 pm,COMMERCIAL FIRE ALARM,"100 BLOCK W SOUTH ST, SOUTH STREET SENIOR 4","Units: E31, TW4",05/02/2024,2024-05-02 17:44:00
5:00 pm,RESIDENTIAL FIRE ALARM (SINGLE FAMILY RESD/ MOBILE HOME),13800 BLOCK FOGGY BOTTOM CT,"Units: E152, FS25",05/02/2024,2024-05-02 17:00:00
3:57 pm,MOTORCYCLE ACCIDENT,URBANA PIKE / BUCKEYSTOWN PIKE,"Radio: 9D Units: A38, PE311, E31, EMS901",05/02/2024,2024-05-02 15:57:00
3:36 pm,VEHICLE ACCIDENT - BLS,GREEN VALLEY RD / PLEASANT GROVE DR,"Units: A259, E251",05/02/2024,2024-05-02 15:36:00
2:48 pm,COMMERCIAL VEHICLE FIRE,"11100 BLOCK WINDSOR RD, WINDSOR KNOLLS MIDDLE SCHOOL",Radio: 9C Units: E251,05/02/2024,2024-05-02 14:48:00
2:38 pm,VEHICLE ACCIDENT - BLS,URBANA PIKE / LOWES LN,Units: E31,05/02/2024,2024-05-02 14:38:00
2:10 pm,VEHICLE ACCIDENT - BLS,URBANA PIKE / LOWES LN,"Units: A39, TW4",05/02/2024,2024-05-02 14:10:00
1:50 pm,VEHICLE ACCIDENT - BLS,"10300 BLOCK LIBERTY RD, PH2","Radio: 9B Units: A179, E172",05/02/2024,2024-05-02 13:50:00
12:36 pm,MUTUAL AID,28900 BLOCK(28607) BLK KEMPTOWN RD,Units: E251,05/02/2024,2024-05-02 12:36:00
12:12 pm,COMMERCIAL FIRE ALARM,"5600 BLOCK MUSSETTER RD, BRIGHT EYES CHILD CARE","Radio: 9C Units: E152, TW4",05/02/2024,2024-05-02 12:12:00
11:40 am,VEHICLE ACCIDENT - BLS,SCHAFFER DR / WAVERLEY DR,Units: E11,05/02/2024,2024-05-02 11:40:00
11:34 am,VEHICLE ACCIDENT - BLS,SCHAFFER DR / WAVERLEY DR,"Units: A19, TW1, FS01",05/02/2024,2024-05-02 11:34:00
10:24 am,COMMERCIAL FIRE ALARM,"7400 BLOCK WILLOW RD, HOMEWOOD AT CRUMLAND",Radio: 9C Units: E291,05/02/2024,2024-05-02 10:24:00
9:16 am,TRANSFORMER FIRE,6500 BLOCK TWIN LAKE DR,Radio: 9C Units: E152,05/02/2024,2024-05-02 09:16:00
9:14 am,TRANSFORMER FIRE,6500 BLOCK TWIN LAKE DR,Radio: 9C Units: BR156,05/02/2024,2024-05-02 09:14:00
8:34 am,VEHICLE ACCIDENT - ALS,"I70EB / 47MM, I70EB / 47MM",Radio: 9D Units: EMSBC900,05/02/2024,2024-05-02 08:34:00
8:31 am,VEHICLE ACCIDENT - ALS,"I70EB / 47MM, I70EB / 47MM",Radio: 9D Units: RE74,05/02/2024,2024-05-02 08:31:00
8:29 am,VEHICLE ACCIDENT - ALS,"I70EB / 47MM, I70EB / 47MM","Radio: 9D Units: E72, E121, R8, A89, ALS8, EMS901",05/02/2024,2024-05-02 08:29:00
7:41 am,MOTORCYCLE ACCIDENT,I70EB / HOWARD CO LINE,Radio: HCA2 Units: E152,05/02/2024,2024-05-02 07:41:00
7:27 am,ELECTRICAL HAZARD INSIDE,1300 BLOCK HAMPSHIRE DR,"Radio: 9C Units: E12, E501",05/02/2024,2024-05-02 07:27:00
7:23 am,VEHICLE ACCIDENT - ROLLOVER,LANDER RD / JEFFERSON PIKE,Radio: 9D Units: CMD20,05/02/2024,2024-05-02 07:23:00
7:18 am,VEHICLE ACCIDENT - ROLLOVER,LANDER RD / JEFFERSON PIKE,"Radio: 9D Units: E201, R20, A209, ALS4, EMS901",05/02/2024,2024-05-02 07:18:00
6:08 am,SMALL FUEL SPILL (50-200 GAL),100 BLOCK BLK RAMP RT15NB TO MOTTER AVE RAMP,Radio: 9C Units: R2,05/02/2024,2024-05-02 06:08:00
6:06 am,SMALL FUEL SPILL (50-200 GAL),100 BLOCK BLK RAMP RT15NB TO MOTTER AVE RAMP,"Radio: 9C Units: PE23, E12, HM33",05/02/2024,2024-05-02 06:06:00
10:37 pm,SERVICE CALL,5600 BLOCK ADAMSTOWN RD,Units: R14,05/01/2024,2024-05-01 22:37:00
8:28 pm,VEHICLE ACCIDENT - ENTRAPMENT,11600 BLOCK GREEN VALLEY RD,Units: CMD17,05/01/2024,2024-05-01 20:28:00
8:25 pm,VEHICLE ACCIDENT - ENTRAPMENT,11600 BLOCK GREEN VALLEY RD,Units: RE171,05/01/2024,2024-05-01 20:25:00
8:23 pm,VEHICLE ACCIDENT - ENTRAPMENT,11600 BLOCK GREEN VALLEY RD,Units: E172,05/01/2024,2024-05-01 20:23:00
8:20 pm,VEHICLE ACCIDENT - ENTRAPMENT,11600 BLOCK GREEN VALLEY RD,Units: BC902,05/01/2024,2024-05-01 20:20:00
8:17 pm,VEHICLE ACCIDENT - ENTRAPMENT,11600 BLOCK GREEN VALLEY RD,"Units: BC901, EMS901, FS17",05/01/2024,2024-05-01 20:17:00
8:16 pm,VEHICLE ACCIDENT - ROLLOVER,11700 BLOCK WOODSBORO PIKE,Units: CMD9,05/01/2024,2024-05-01 20:16:00
8:10 pm,VEHICLE ACCIDENT - ROLLOVER,11700 BLOCK WOODSBORO PIKE,"Units: E91, RE171, A169, ALS17, BC902, EMS902",05/01/2024,2024-05-01 20:10:00
7:14 pm,PEDESTRIAN STRUCK,HAMBURG RD / BETHEL RD,Units: BC902,05/01/2024,2024-05-01 19:14:00
7:14 pm,RESIDENTIAL FIRE ALARM (SINGLE FAMILY RESD/ MOBILE HOME),400 BLOCK TILLER ST,"Units: E331, FS03",05/01/2024,2024-05-01 19:14:00
7:11 pm,VEHICLE ACCIDENT - BLS,OLD NATIONAL PIKE / MOUNT PHILLIP RD,"Units: E121, FS01",05/01/2024,2024-05-01 19:11:00
7:08 pm,PEDESTRIAN STRUCK,HAMBURG RD / BETHEL RD,"Units: A299, ALS31, E291, EMS901",05/01/2024,2024-05-01 19:08:00
6:51 pm,VEHICLE ACCIDENT - BLS,"5400 BLOCK BALLENGER CREEK PIKE, BALLENGER CREEK DISTRICT PARK","Units: A39, PE311",05/01/2024,2024-05-01 18:51:00
6:43 pm,OUTSIDE FIRE,100 BLOCK WALNUT POND CT,Units: E72,05/01/2024,2024-05-01 18:43:00
6:40 pm,OUTSIDE FIRE,100 BLOCK WALNUT POND CT,Units: BR75,05/01/2024,2024-05-01 18:40:00
5:40 pm,RESIDENTIAL FIRE ALARM (SINGLE FAMILY RESD/ MOBILE HOME),200 BLOCK BISHOPS GLEN DR,Units: E12,05/01/2024,2024-05-01 17:40:00
5:37 pm,RESIDENTIAL FIRE ALARM (SINGLE FAMILY RESD/ MOBILE HOME),200 BLOCK BISHOPS GLEN DR,Units: E12,05/01/2024,2024-05-01 17:37:00
5:30 pm,COMMERCIAL FIRE ALARM,1200 BLOCK DAHLIA LN,Units: E12,05/01/2024,2024-05-01 17:30:00
5:11 pm,COMMERCIAL FIRE ALARM,1200 BLOCK DAHLIA LN,"Units: E12, TW4",05/01/2024,2024-05-01 17:11:00
4:50 pm,VEHICLE ACCIDENT - BLS,7000 BLOCK ALLINGTON MANOR CIR E,"Units: A318, PE311",05/01/2024,2024-05-01 16:50:00
4:32 pm,VEHICLE ACCIDENT - BLS,"RT15SB / W PATRICK ST, RT15SB / W PATRICK ST","Units: E12, E31, R2, A18, A38",05/01/2024,2024-05-01 16:32:00
2:20 pm,COMMERCIAL FIRE ALARM,"3900 BLOCK BUCKEYSTOWN PIKE, Apt/Unit:ROOM 121, SAINT JOHNS CATHOLIC PREP",Units: PE311,05/01/2024,2024-05-01 14:20:00
12:57 pm,RESIDENTIAL FIRE ALARM (SINGLE FAMILY RESD/ MOBILE HOME),5800 BLOCK DRAWBRIDGE CT,Radio: 9C Units: PE311,05/01/2024,2024-05-01 12:57:00
12:56 pm,RESIDENTIAL FIRE ALARM (SINGLE FAMILY RESD/ MOBILE HOME),5800 BLOCK DRAWBRIDGE CT,Radio: 9C Units: E31,05/01/2024,2024-05-01 12:56:00
12:50 pm,CHECK UP AFTER ACCIDENT - POLICE ON SCENE,"RT85 / I270, RT85 / I270",Units: PE311,05/01/2024,2024-05-01 12:50:00
12:14 pm,VEHICLE ACCIDENT - BLS,BUCKEYSTOWN PIKE / SPECTRUM DR,"Radio: 9B Units: A339, PE311",05/01/2024,2024-05-01 12:14:00
11:45 am,VEHICLE ACCIDENT - BLS,ROSEMONT AVE / SCHLEY AVE,"Units: A19, E12",05/01/2024,2024-05-01 11:45:00
11:44 am,WIRES DOWN OR ARCING,WOODSBORO RD / HOFFMAN SEACHRIST RD,Units: E162,05/01/2024,2024-05-01 11:44:00
9:08 am,RESIDENTIAL FIRE ALARM (SINGLE FAMILY RESD/ MOBILE HOME),3600 BLOCK DENISON ST,Units: E232,05/01/2024,2024-05-01 09:08:00
8:47 am,VEHICLE ACCIDENT - BLS,"5000 BLOCK BUCKEYSTOWN PIKE, WENDYS",Radio: 9B Units: PE311,05/01/2024,2024-05-01 08:47:00
8:05 am,CHECK UP AFTER ACCIDENT - POLICE ON SCENE,BALLENGER CREEK PIKE / JEFFERSON PIKE,Radio: 9B Units: PE311,05/01/2024,2024-05-01 08:05:00
6:04 am,MUTUAL AID,1700 BLOCK CARROLLS TRACT RD,"Units: EK64, R6",05/01/2024,2024-05-01 06:04:00
9:19 pm,VEHICLE ACCIDENT - BLS,JEFFERSON PIKE / ALFORD LN,Units: E201,05/08/2024,2024-05-08 21:19:00
9:17 pm,VEHICLE ACCIDENT - BLS,JEFFERSON PIKE / ALFORD LN,Units: R20,05/08/2024,2024-05-08 21:17:00
9:15 pm,VEHICLE ACCIDENT - BLS,JEFFERSON PIKE / ALFORD LN,Units: E201,05/08/2024,2024-05-08 21:15:00
12:36 am,VEHICLE ACCIDENT - ROLLOVER,"I70WB / HOLLOW RD, I70WB / HOLLOW RD","Units: E121, R8, A89, ALS8, EMS901",05/09/2024,2024-05-09 00:36:00
3:38 am,SERVICE CALL,"6400 BLOCK MERCANTILE DR E, Apt/Unit:108, CAMDEN CLEARBROOK APTS 6400 BLOCK MERCANTILE DR",Units: PE311,05/09/2024,2024-05-09 03:38:00
4:50 am,RESIDENTIAL FIRE ALARM (SINGLE FAMILY RESD/ MOBILE HOME),1900 BLOCK BELFORD DR,Units: E291,05/09/2024,2024-05-09 04:50:00
7:03 am,RESIDENTIAL FIRE ALARM (SINGLE FAMILY RESD/ MOBILE HOME),5700 BLOCK HAWK RIDGE RD,Radio: 9B Units: E31,05/09/2024,2024-05-09 07:03:00
9:28 am,WIRES DOWN OR ARCING,"100 BLOCK E SECOND ST, WEE FOLK SCHOOL",Radio: 9C Units: E31,05/09/2024,2024-05-09 09:28:00
10:23 am,VEHICLE ACCIDENT - BLS,"RT15NB / DEVILBISS BRIDGE RD, RT15NB / DEVILBISS BRIDGE RD","Radio: 9B Units: A229, E291, EK224",05/09/2024,2024-05-09 10:23:00
1:31 pm,COMMERCIAL FIRE ALARM,"5600 BLOCK MUSSETTER RD, BRIGHT EYES CHILD CARE","Radio: 9C Units: E153, TW4",05/09/2024,2024-05-09 13:31:00
4:45 pm,ENTRAPMENT - PERIPHERAL,200 BLOCK BISHOPS GLEN DR,"Radio: 9D Units: E12, R2, A19",05/09/2024,2024-05-09 16:45:00
6:31 pm,VEHICLE ACCIDENT - ENTRAPMENT,"RT80 / RT75, RT80 / RT75","Units: E251, R15, A259, ALS23, BC901, EMS901",05/09/2024,2024-05-09 18:31:00
6:40 pm,SERVICE CALL,"1000 BLOCK W PATRICK ST, 40 WEST GETGO",Units: E12,05/09/2024,2024-05-09 18:40:00
7:07 pm,VEHICLE ACCIDENT - BLS,MONOCACY BLVD / S EAST ST,"Units: A29, E31",05/09/2024,2024-05-09 19:07:00
7:18 pm,VEHICLE ACCIDENT - ALS,TANEY AVE / W TWELFTH ST,"Units: ALS2, EMS902",05/09/2024,2024-05-09 19:18:00
8:48 pm,VEHICLE ACCIDENT - BLS,"RT144 / EAGLEHEAD DR, RT144 / EAGLEHEAD DR","Units: A339, E331, FS15",05/09/2024,2024-05-09 20:48:00
11:20 pm,ODOR OF SMOKE INSIDE,11800 BLOCK RIDGEWAY DR,"Units: E251, E153, R15, K23",05/09/2024,2024-05-09 23:20:00
11:33 pm,ODOR OF SMOKE INSIDE,11800 BLOCK RIDGEWAY DR,Units: CMD15,05/09/2024,2024-05-09 23:33:00
12:18 am,RESIDENTIAL FIRE ALARM (SINGLE FAMILY RESD/ MOBILE HOME),1300 BLOCK MULBERRY CT,Units: E12,05/10/2024,2024-05-10 00:18:00
8:12 am,WIRES DOWN OR ARCING,"QUINN ORCHARD RD / RAY SMITH RD, IAO","Radio: 9C Units: E331, FS03",05/10/2024,2024-05-10 08:12:00
9:05 am,VEHICLE ACCIDENT - BLS,8500 BLOCK RED SAGE WAY S,Radio: 9B Units: A259,05/10/2024,2024-05-10 09:05:00
9:04 am,COMMERCIAL FIRE ALARM,"7400 BLOCK NEW HORIZON WAY, Apt/Unit:SUITE 100","Radio: 9C Units: E31, TW4, FS31",05/10/2024,2024-05-10 09:04:00
10:49 am,SERVICE CALL,9700 BLOCK KEYSVILLE RD,Radio: 9C Units: E61,05/10/2024,2024-05-10 10:49:00
12:46 pm,VEHICLE ACCIDENT - ROLLOVER,"2900 BLOCK PRICES DISTILLERY RD, GREEN VALLEY ANIMAL HOSPITAL","Units: E251, R15, A259, BC901, EMS901",05/10/2024,2024-05-10 12:46:00
12:55 pm,GAS LEAK INSIDE,17000 BLOCK EYLERS VALLEY RD,Units: R10,05/10/2024,2024-05-10 12:55:00
1:04 pm,GAS LEAK INSIDE,17000 BLOCK EYLERS VALLEY RD,"Units: E61, E102",05/10/2024,2024-05-10 13:04:00
1:15 pm,GAS LEAK INSIDE,17000 BLOCK EYLERS VALLEY RD,Units: CMD6,05/10/2024,2024-05-10 13:15:00
1:11 pm,GAS LEAK INSIDE,17000 BLOCK EYLERS VALLEY RD,"Units: HM33, A69, ALS30, BC902, SAF901",05/10/2024,2024-05-10 13:11:00
2:28 pm,VEHICLE ACCIDENT - BLS,"200 BLOCK E MAIN ST, VALLEY ONE STOP",Units: RE74,05/10/2024,2024-05-10 14:28:00
2:27 pm,VEHICLE ACCIDENT - BLS,"200 BLOCK E MAIN ST, VALLEY ONE STOP","Units: A78, E72",05/10/2024,2024-05-10 14:27:00
3:24 pm,SMALL FUEL SPILL (50-200 GAL),"8400 BLOCK OPOSSUMTOWN PIKE, SAINT JOHNS REGIONAL CATHOLIC SCHOOL","Units: E291, PE23, HM33",05/10/2024,2024-05-10 15:24:00
4:41 pm,VEHICLE ACCIDENT - BLS,CRESTWOOD BLVD / ROSEBAY CT,"Radio: 9B Units: A318, PE311",05/10/2024,2024-05-10 16:41:00
5:02 pm,CHECK UP AFTER ACCIDENT - POLICE ON SCENE,CRESTWOOD BLVD / ROSEBAY CT,"Units: A319, PE311",05/10/2024,2024-05-10 17:02:00
5:29 pm,VEHICLE ACCIDENT - BLS,PETERSVILLE RD / SOUDER RD,"Units: A196, RE52",05/10/2024,2024-05-10 17:29:00
6:28 pm,MUTUAL AID,"26000 BLOCK BRIGADEER PL, Apt/Unit:B",Units: E251,05/10/2024,2024-05-10 18:28:00
8:43 pm,WIRES DOWN OR ARCING,10800 BLOCK HIGHLAND SCHOOL RD,Units: E82,05/10/2024,2024-05-10 20:43:00
8:41 pm,WIRES DOWN OR ARCING,10800 BLOCK HIGHLAND SCHOOL RD,Units: BR85,05/10/2024,2024-05-10 20:41:00
8:34 pm,WIRES DOWN OR ARCING,10800 BLOCK HIGHLAND SCHOOL RD,Units: BR216,05/10/2024,2024-05-10 20:34:00
8:32 pm,COMMERCIAL FIRE ALARM,200 BLOCK N MARKET ST,"Units: E31, TW4",05/10/2024,2024-05-10 20:32:00
9:19 pm,VEHICLE ACCIDENT - BLS,5000 BLOCK IRONSIDES DR,"Units: A318, PE311",05/10/2024,2024-05-10 21:19:00
9:47 pm,PEDESTRIAN STRUCK,"W THIRD ST / N MARKET ST, MARYLAND APTS",Units: CMD3,05/10/2024,2024-05-10 21:47:00
9:41 pm,PEDESTRIAN STRUCK,"W THIRD ST / N MARKET ST, MARYLAND APTS","Units: A38, ALS2, E31, EMS901",05/10/2024,2024-05-10 21:41:00
10:08 pm,PEDESTRIAN STRUCK,"W THIRD ST / N MARKET ST, MARYLAND APTS",Units: EMS901,05/10/2024,2024-05-10 22:08:00
11:49 pm,MUTUAL AID,JAMES MONROE HWY / LUCKETTS RD,Units: A149,05/10/2024,2024-05-10 23:49:00
12:37 am,WIRES DOWN OR ARCING,GLISSANS MILL RD / HARRISVILLE RD,Radio: 9C Units: E172,05/11/2024,2024-05-11 00:37:00
12:35 am,WIRES DOWN OR ARCING,GLISSANS MILL RD / HARRISVILLE RD,Radio: 9C Units: BR176,05/11/2024,2024-05-11 00:35:00
1:46 am,VEHICLE FIRE,GREEN VALLEY RD / BALDWIN RD,Radio: 9C Units: E152,05/11/2024,2024-05-11 01:46:00
1:57 am,ODOR OF SMOKE INSIDE,"5800 BLOCK BURIN ST, Apt/Unit:303","Radio: 9C Units: E331, E31, R15",05/11/2024,2024-05-11 01:57:00
2:08 am,STABBING,100 BLOCK MCMURRAY ST,"Radio: 9D Units: A38, ALS2, TW4, BC901, EMS901",05/11/2024,2024-05-11 02:08:00
2:23 am,ODOR OF SMOKE INSIDE,"5800 BLOCK BURIN ST, Apt/Unit:303",Units: HM33,05/11/2024,2024-05-11 02:23:00
2:28 am,ODOR OF SMOKE INSIDE,"5800 BLOCK BURIN ST, Apt/Unit:303",Units: CMD15,05/11/2024,2024-05-11 02:28:00
2:24 am,ODOR OF SMOKE INSIDE,"5800 BLOCK BURIN ST, Apt/Unit:303",Units: HM33,05/11/2024,2024-05-11 02:24:00
7:29 am,ELEVATOR MALFUNCTION,100 BLOCK STEINER WAY,Radio: 9C Units: TW4,05/11/2024,2024-05-11 07:29:00
7:22 am,ELEVATOR MALFUNCTION,100 BLOCK STEINER WAY,"Radio: 9C Units: R2, TW1",05/11/2024,2024-05-11 07:22:00
7:21 am,ODOR OF SMOKE INSIDE,"500 BLOCK W SOUTH ST, WEST END LAUNDROMAT","Radio: 9C Units: E31, PE23, TW4",05/11/2024,2024-05-11 07:21:00
9:15 am,COMMERCIAL FIRE ALARM,"7400 BLOCK WILLOW RD, Apt/Unit:217, WOODSBORO BANK HOMEWOOD AT CRUMLAND",Radio: 9C Units: E291,05/11/2024,2024-05-11 09:15:00
10:11 am,VEHICLE ACCIDENT - BLS,"RT15SB / COLLEGE LN, RT15SB / COLLEGE LN","Radio: 9B Units: A69, EK64",05/11/2024,2024-05-11 10:11:00
10:13 am,VEHICLE ACCIDENT - BLS,"RT15SB / COLLEGE LN, RT15SB / COLLEGE LN",Radio: 9B Units: R6,05/11/2024,2024-05-11 10:13:00
1:15 pm,INVESTIGATION,6600 BLOCK EDGEWOOD RD,Units: E152,05/11/2024,2024-05-11 13:15:00
2:06 pm,MOTORCYCLE ACCIDENT,OLD NATIONAL PIKE / FOX GAP RD,"Radio: 9D Units: A78, ALS8, EMS901",05/11/2024,2024-05-11 14:06:00
2:22 pm,VEHICLE ACCIDENT - BLS,W SEVENTH ST / N BENTZ ST,Units: PE23,05/11/2024,2024-05-11 14:22:00
2:20 pm,VEHICLE ACCIDENT - BLS,"I270NB / BENNETT CREEK, I270NB / BENNETT CREEK","Radio: 9B Units: E232, R2, A239",05/11/2024,2024-05-11 14:20:00
2:23 pm,VEHICLE ACCIDENT - BLS,"I270NB / BENNETT CREEK, I270NB / BENNETT CREEK",Radio: 9B Units: A259,05/11/2024,2024-05-11 14:23:00
4:11 pm,GAS LEAK INSIDE,10600 BLOCK NATHANIEL WAY,Radio: 9C Units: CMD15,05/11/2024,2024-05-11 16:11:00
4:03 pm,GAS LEAK INSIDE,10600 BLOCK NATHANIEL WAY,"Units: E152, E331, R15",05/11/2024,2024-05-11 16:03:00
4:16 pm,COMMERCIAL FIRE ALARM,"9000 BLOCK HARRIS ST, VILLAGES OF URBANA COMMUNITY ASSOCIATION",Units: E232,05/11/2024,2024-05-11 16:16:00
6:16 pm,WIRES DOWN OR ARCING,13400 BLOCK REED RD,Radio: 9C Units: E102,05/11/2024,2024-05-11 18:16:00
6:14 pm,WIRES DOWN OR ARCING,13400 BLOCK REED RD,Radio: 9C Units: BR106,05/11/2024,2024-05-11 18:14:00
7:20 pm,VEHICLE ACCIDENT - BLS,"I70WB / MONUMENT RD, I70WB / MONUMENT RD","Units: E72, R8, A89",05/11/2024,2024-05-11 19:20:00
7:18 pm,COMMERCIAL FIRE ALARM,100 BLOCK W CHURCH ST,"Radio: 9C Units: E31, TW4",05/11/2024,2024-05-11 19:18:00
7:15 pm,INVESTIGATION,"100 BLOCK WAVERLY DR, Apt/Unit:202",Units: E12,05/11/2024,2024-05-11 19:15:00
7:22 pm,VEHICLE ACCIDENT - BLS,"I70WB / MONUMENT RD, I70WB / MONUMENT RD",Units: RE74,05/11/2024,2024-05-11 19:22:00
7:47 pm,VEHICLE ACCIDENT - ENTRAPMENT,200 BLOCK MONTEVUE LN,Radio: 9D Units: CMD1,05/11/2024,2024-05-11 19:47:00
7:43 pm,VEHICLE ACCIDENT - ENTRAPMENT,200 BLOCK MONTEVUE LN,"Radio: 9D Units: E12, R2, A19, PE23, EMS902",05/11/2024,2024-05-11 19:43:00
8:41 pm,APPLIANCE FIRE CONTAINED,10600 BLOCK BETHEL RD,Radio: 9C Units: K10,05/11/2024,2024-05-11 20:41:00
8:36 pm,APPLIANCE FIRE CONTAINED,10600 BLOCK BETHEL RD,"Radio: 9C Units: EK224, E291, Q11, K22",05/11/2024,2024-05-11 20:36:00
9:07 pm,PEDESTRIAN STRUCK,"100 BLOCK S EAST ST, MARC TRAIN STATION FREDERICK","Radio: 9D Units: A39, ALS2, E31, EMS901",05/11/2024,2024-05-11 21:07:00
10:22 pm,MOUNTAIN RESCUE,"LAT: <39.34226> LONG: <-77.67422>, APPALACHIAN TRAIL ED GARVEY SHELTER","Radio: 9D Units: RE52, E201, R19, TR29, EMSUTV19, A196, ALS20, SAF901, EMS901",05/11/2024,2024-05-11 22:22:00
10:39 pm,MOUNTAIN RESCUE,"LAT: <39.34226> LONG: <-77.67422>, APPALACHIAN TRAIL ED GARVEY SHELTER",Radio: 9D Units: CMD5,05/11/2024,2024-05-11 22:39:00
10:34 pm,MOUNTAIN RESCUE,"LAT: <39.34226> LONG: <-77.67422>, APPALACHIAN TRAIL ED GARVEY SHELTER","Radio: 9D Units: R20, A197",05/11/2024,2024-05-11 22:34:00
11:23 pm,VEHICLE ACCIDENT - BLS,"I70WB / E SOUTH ST(E SOUTH ST), I70WB / E SOUTH ST","Units: E31, E12, R2, A39, A18",05/11/2024,2024-05-11 23:23:00
11:39 pm,HOUSE FIRE,19600 BLOCK WESTERLY AVE,Units: R14,05/11/2024,2024-05-11 23:39:00
11:46 pm,VEHICLE ACCIDENT - BLS,I270SB BTWN RT121-RT27,Units: E232,05/11/2024,2024-05-11 23:46:00
11:57 pm,VEHICLE ACCIDENT - BLS,"I70WB / RT85, I70WB / RT85","Units: E31, E12, R2, A38, A18",05/11/2024,2024-05-11 23:57:00
12:16 am,UNIT TRANSFER TO OTHER STATION,"20600 BLOCK FREDERICK RD, STATION MC734 - GERMANTOWN/MILESTONE",Radio: 7A2 Units: R15,05/12/2024,2024-05-12 00:16:00
1:38 am,RESIDENTIAL FIRE ALARM (SINGLE FAMILY RESD/ MOBILE HOME),100 BLOCK FAIRVIEW AVE,"Units: E31, TW4, FS01",05/12/2024,2024-05-12 01:38:00
9:05 am,COMMERCIAL FIRE ALARM,4600 BLOCK WEDGEWOOD BLVD,"Radio: 9C Units: PE311, TW4",05/12/2024,2024-05-12 09:05:00
11:12 am,COMMERCIAL FIRE ALARM,100 BLOCK N SETON AVE,Radio: 9C Units: E61,05/12/2024,2024-05-12 11:12:00
12:00 pm,COMMERCIAL FIRE ALARM,"2100 BLOCK WHITTIER DR, SOMERFORD PLACE",Units: E12,05/12/2024,2024-05-12 12:00:00
12:30 pm,HOUSE FIRE,7100 BLOCK MASTERS RD,"Units: E152, E331, E172, E111, PE23, R15, Q11, R2, A158, ALS17, BC902, BC901, SAF901, FS15",05/12/2024,2024-05-12 12:30:00
12:37 pm,HOUSE FIRE,7100 BLOCK MASTERS RD,"Units: E31, R20, TW4",05/12/2024,2024-05-12 12:37:00
1:34 pm,COMMERCIAL FIRE ALARM,"7500 BLOCK HAYWARD RD, BOE ISA BUILDING",Units: E291,05/12/2024,2024-05-12 13:34:00
1:33 pm,COMMERCIAL FIRE ALARM,"100 BLOCK WILLOWDALE DR, WILLOWDALE CROSSING APARTMENTS","Units: E12, TW4, FS01",05/12/2024,2024-05-12 13:33:00
1:47 pm,VEHICLE ACCIDENT - BLS,"RT15SB / N FRANKLINVILLE RD (S), RT15SB / N FRANKLINVILLE RD","Units: A307, E102",05/12/2024,2024-05-12 13:47:00
4:30 pm,RESIDENTIAL FIRE ALARM (SINGLE FAMILY RESD/ MOBILE HOME),2000 BLOCK CHAPEL CT,Radio: 9C Units: E12,05/12/2024,2024-05-12 16:30:00
6:35 pm,FLOODING CONDITION,"3600 BLOCK PETERSVILLE RD, MERRYLAND PARK",Radio: 9C Units: T5,05/12/2024,2024-05-12 18:35:00
8:35 pm,VEHICLE ACCIDENT - BLS,"RT15 / MOUNTVILLE RD, RT15 / MOUNTVILLE RD",Radio: 9B Units: R20,05/12/2024,2024-05-12 20:35:00
8:32 pm,VEHICLE ACCIDENT - BLS,MOUNTVILLE RD / BASFORD RD,"Radio: 9B Units: A149, E201",05/12/2024,2024-05-12 20:32:00
9:16 pm,LIGHT SMOKE CONDITIONS,6100 BLOCK DOCK ST,"Radio: 9C Units: E12, PE311, TW4",05/12/2024,2024-05-12 21:16:00
10:08 pm,VEHICLE ACCIDENT - BLS,"RT40 / RT15, RT40 / RT15","Radio: 9B Units: A39, TW4, FS01",05/12/2024,2024-05-12 22:08:00
10:51 pm,VEHICLE FIRE,"3800 BLOCK BURKITTSVILLE RD, SHEETZ BRUNSWICK",Radio: 9C Units: RE52,05/12/2024,2024-05-12 22:51:00
5:01 am,UNKNOWN ODOR INSIDE,1700 BLOCK HILLMEADE SQ,"Units: E291, PE23, R2, FS29",05/13/2024,2024-05-13 05:01:00
5:40 am,VEHICLE FIRE REPORTED OUT,100 BLOCK BLK RAMP REST AREA I7100 BLOCKWB -MYER RAMP,"Radio: 9C Units: E82, FS08",05/13/2024,2024-05-13 05:40:00
7:07 am,COMMERCIAL FIRE ALARM,"100 BLOCK S CARROLL ST, Apt/Unit:SUITE 100, MSD SHOCKLEY HOUSE","Units: E31, TW4",05/13/2024,2024-05-13 07:07:00
7:54 am,COMMERCIAL FIRE ALARM,"600 BLOCK SOLAREX CT, ASTRA ZENECA #600 BLOCK","Units: PE311, TW1",05/13/2024,2024-05-13 07:54:00
8:45 am,RESIDENTIAL FIRE ALARM (SINGLE FAMILY RESD/ MOBILE HOME),7200 BLOCK RAINBOW LN,Units: E291,05/13/2024,2024-05-13 08:45:00
9:38 am,BRUSH FIRE,100 BLOCK BLK RAMP I27100 BLOCKSB TO RT8100 BLOCK RAMP,Units: BR235,05/13/2024,2024-05-13 09:38:00
9:48 am,RESIDENTIAL FIRE ALARM (SINGLE FAMILY RESD/ MOBILE HOME),2500 BLOCK POTTING SHED LN,Radio: 9C Units: E291,05/13/2024,2024-05-13 09:48:00
10:10 am,MUTUAL AID,I270SB/RT109,Units: E232,05/13/2024,2024-05-13 10:10:00
11:00 am,MUTUAL AID,400 BLOCK WINDY KNOLL,Units: A158,05/13/2024,2024-05-13 11:00:00
12:56 pm,CHECK UP AFTER ACCIDENT - POLICE ON SCENE,"1000 BLOCK W PATRICK ST, WAWA","Radio: 9B Units: A19, E12",05/13/2024,2024-05-13 12:56:00
2:28 pm,VEHICLE ACCIDENT - BLS,100 BLOCK BLK RAMP OPOSSUMTOWN PK TO RT15SB RAMP,"Radio: 9B Units: A29, PE23",05/13/2024,2024-05-13 14:28:00
4:34 pm,WIRES DOWN OR ARCING,CHAPEL ALY / E FIFTH ST,Radio: 9C Units: PE23,05/13/2024,2024-05-13 16:34:00
5:01 pm,WIRES DOWN OR ARCING,CHAPEL ALY / E FIFTH ST,Radio: 9C Units: PE23,05/13/2024,2024-05-13 17:01:00
5:15 pm,FUEL SPILL,2600 BLOCK LYDIA CT,Radio: 9C Units: R14,05/13/2024,2024-05-13 17:15:00
5:13 pm,FUEL SPILL,2600 BLOCK LYDIA CT,Radio: 9C Units: E141,05/13/2024,2024-05-13 17:13:00
5:28 pm,VEHICLE ACCIDENT - ROLLOVER,"RT194 / GRUBER RD, RT194 / GRUBER RD",Radio: 9D Units: CMD9,05/13/2024,2024-05-13 17:28:00
5:27 pm,VEHICLE ACCIDENT - ROLLOVER,"RT194 / GRUBER RD, RT194 / GRUBER RD",Radio: 9D Units: E162,05/13/2024,2024-05-13 17:27:00
5:23 pm,OUTSIDE FIRE,I70WB / RT355,Radio: 9C Units: E31,05/13/2024,2024-05-13 17:23:00
5:21 pm,OUTSIDE FIRE,I70WB / RT355,"Radio: 9C Units: BR35, PE311",05/13/2024,2024-05-13 17:21:00
5:20 pm,VEHICLE ACCIDENT - ROLLOVER,"RT194 / GRUBER RD, RT194 / GRUBER RD","Radio: 9D Units: E91, R10, A249, ALS17, BC902, EMS902",05/13/2024,2024-05-13 17:20:00
5:47 pm,VEHICLE ACCIDENT - ROLLOVER,"RT194 / GRUBER RD, RT194 / GRUBER RD",Radio: 9D Units: EMS902,05/13/2024,2024-05-13 17:47:00
5:41 pm,VEHICLE ACCIDENT - BLS,8200 BLOCK WOODSBORO PIKE,"Radio: 9B Units: A247, A19, E111",05/13/2024,2024-05-13 17:41:00
7:38 pm,BUILDING FIRE,8600 BLOCK SATINWOOD DR,"Radio: 9D Units: E232, E251, E31, PE311, R2, TW4, A239, ALS23, BC901, BC902, SAF901, FS23",05/13/2024,2024-05-13 19:38:00
10:03 pm,COMMERCIAL FIRE ALARM,200 BLOCK E THIRD ST,"Radio: 9C Units: E31, TW4",05/13/2024,2024-05-13 22:03:00
1:59 am,RESIDENTIAL FIRE ALARM (SINGLE FAMILY RESD/ MOBILE HOME),9100 BLOCK KENWAY LN,Units: E232,05/14/2024,2024-05-14 01:59:00
2:32 am,VEHICLE ACCIDENT - BLS,BOLIVAR RD / MARKER RD,"Units: A78, RE74",05/14/2024,2024-05-14 02:32:00
3:40 am,COMMERCIAL FIRE ALARM,"300 BLOCK N MARKET ST, Apt/Unit:E","Units: E31, TW4",05/14/2024,2024-05-14 03:40:00
8:15 am,COMMERCIAL FIRE ALARM,6500 BLOCK EWALD CT,"Radio: 9C Units: PE311, TW4",05/14/2024,2024-05-14 08:15:00
9:11 am,COMMERCIAL FIRE ALARM,"100 BLOCK S MARKET ST, SMOKERS PARADISE","Units: E31, TW4",05/14/2024,2024-05-14 09:11:00
9:53 am,VEHICLE FIRE,4100 BLOCK CHERRY LN,"Units: E201, E121, E72, TW4, A209, SAF901",05/14/2024,2024-05-14 09:53:00
9:59 am,VEHICLE FIRE,4100 BLOCK CHERRY LN,Units: EK204,05/14/2024,2024-05-14 09:59:00
10:21 am,BUILDING FIRE,"7300 BLOCK GROVE RD, Apt/Unit:E","Units: PE23, E331, E501, R2, TW1, A319, ALS31, BC901, SAF901, FS31",05/14/2024,2024-05-14 10:21:00
10:17 am,LIGHT SMOKE CONDITIONS,"7300 BLOCK GROVE RD, Apt/Unit:E","Units: PE311, E31, TW4",05/14/2024,2024-05-14 10:17:00
10:25 am,BUILDING FIRE,"7300 BLOCK GROVE RD, Apt/Unit:E",Units: CMD31,05/14/2024,2024-05-14 10:25:00
10:33 am,VEHICLE ACCIDENT - ROLLOVER,10500 BLOCK TANEYTOWN PIKE,"Units: E61, R6, A68, ALS30, BC902, EMS902, FS06",05/14/2024,2024-05-14 10:33:00
11:19 am,BUILDING FIRE,"9000 BLOCK AMELUNG ST, URBANA LIBRARY","Units: E232, E251, E31, PE311, R2, TW4, A239, ALS23, BC901, SAF901, FS23",05/14/2024,2024-05-14 11:19:00
11:24 am,BUILDING FIRE,"9000 BLOCK AMELUNG ST, URBANA LIBRARY",Units: CMD23,05/14/2024,2024-05-14 11:24:00
11:52 am,VEHICLE ACCIDENT - ALS,"RT40 / HILLCREST DR, RT40 / HILLCREST DR","Units: ALS2, EMS902",05/14/2024,2024-05-14 11:52:00
11:51 am,VEHICLE ACCIDENT - BLS,"RT40 / HILLCREST DR, RT40 / HILLCREST DR","Units: A18, E12",05/14/2024,2024-05-14 11:51:00
12:23 pm,VEHICLE ACCIDENT - BLS,BALL RD / URBANA PIKE,"Radio: 9B Units: A239, E232",05/14/2024,2024-05-14 12:23:00
12:52 pm,WIRES DOWN OR ARCING,RIDGE RD / OLD NATIONAL PIKE,Radio: 9C Units: E121,05/14/2024,2024-05-14 12:52:00
1:17 pm,ELECTRICAL HAZARD INSIDE,500 BLOCK LOGAN ST,"Radio: 9C Units: E31, E12, TW4",05/14/2024,2024-05-14 13:17:00
1:15 pm,VEHICLE ACCIDENT - ROLLOVER,"RT26 / RT15, RT26 / RT15","Units: PE23, R2, A29, ALS2, BC902, EMS902, FS29",05/14/2024,2024-05-14 13:15:00
1:52 pm,GAS LEAK OUTSIDE,100 BLOCK E SECOND ST,Radio: 9C Units: E31,05/14/2024,2024-05-14 13:52:00
2:11 pm,COMMERCIAL FIRE ALARM,2200 BLOCK VILLAGE SQUARE RD,"Radio: 9C Units: E291, Q11",05/14/2024,2024-05-14 14:11:00
3:14 pm,VEHICLE ACCIDENT - ROLLOVER,"5500 BLOCK MOUNT ZION RD, STADLER GARDEN CENTERS NURSERY","Radio: 9D Units: E201, R20, A209, ALS20, EMS901",05/14/2024,2024-05-14 15:14:00
3:36 pm,VEHICLE ACCIDENT - BLS,"5400 BLOCK URBANA PIKE, TARGET","Radio: 9B Units: A39, E31",05/14/2024,2024-05-14 15:36:00
3:31 pm,APPLIANCE FIRE CONTAINED,1700 BLOCK DYRHAM PARK DR,Radio: 9C Units: E23,05/14/2024,2024-05-14 15:31:00
3:30 pm,APPLIANCE FIRE CONTAINED,1700 BLOCK DYRHAM PARK DR,"Radio: 9C Units: E12, E31, TW4",05/14/2024,2024-05-14 15:30:00
7:38 pm,SMALL FUEL SPILL (50-200 GAL),1500 BLOCK W EIGHTH ST,"Units: E501, E502, HM33, FS01",05/14/2024,2024-05-14 19:38:00
7:43 pm,SMALL FUEL SPILL (50-200 GAL),1500 BLOCK W EIGHTH ST,Units: R2,05/14/2024,2024-05-14 19:43:00
7:41 pm,SMALL FUEL SPILL (50-200 GAL),1500 BLOCK W EIGHTH ST,Units: PE23,05/14/2024,2024-05-14 19:41:00
7:53 pm,CHECK UP AFTER ACCIDENT - POLICE ON SCENE,"I70EB / 62MM, I70EB / 62MM",Units: E152,05/14/2024,2024-05-14 19:53:00
7:52 pm,CHECK UP AFTER ACCIDENT - POLICE ON SCENE,"I70EB / 62MM, I70EB / 62MM","Units: E31, E153, R15, A39, A159, FS33",05/14/2024,2024-05-14 19:52:00
8:30 pm,COMMERCIAL FIRE ALARM,"700 BLOCK W PATRICK ST, TRINITY UNITED METHODIST CHURCH","Units: E31, TW4",05/14/2024,2024-05-14 20:30:00
8:55 pm,COMMERCIAL FIRE ALARM,"1000 BLOCK W PATRICK ST, H MART",Radio: 9C Units: E12,05/14/2024,2024-05-14 20:55:00
9:15 pm,COMMERCIAL FIRE ALARM,"700 BLOCK W PATRICK ST, TRINITY UNITED METHODIST CHURCH","Radio: 9C Units: E31, TW4",05/14/2024,2024-05-14 21:15:00
7:00 am,COMMERCIAL FIRE ALARM,"700 BLOCK W PATRICK ST, TRINITY UNITED METHODIST CHURCH","Units: E31, TW4",05/15/2024,2024-05-15 07:00:00
6:52 am,RESIDENTIAL FIRE ALARM (SINGLE FAMILY RESD/ MOBILE HOME),2600 BLOCK BEAR DEN RD,Units: E291,05/15/2024,2024-05-15 06:52:00
9:08 am,CHECK UP AFTER ACCIDENT - POLICE ON SCENE,"I270NB / I70, I270NB / I70","Units: PE311, E12, R2, A319, A19",05/15/2024,2024-05-15 09:08:00
9:19 am,SMALL FUEL SPILL (50-200 GAL),100 BLOCK HEATHFIELD DR,Units: E12,05/15/2024,2024-05-15 09:19:00
10:41 am,COMMERCIAL FIRE ALARM,3500 BLOCK STARLIGHT ST,Units: E232,05/15/2024,2024-05-15 10:41:00
12:43 pm,VEHICLE ACCIDENT - BLS,"I70WB / RT144 (NEW MARKET), I70WB / RT144","Units: E152, E331, R15, A159, A39",05/15/2024,2024-05-15 12:43:00
12:55 pm,VEHICLE ACCIDENT - BLS,"I70WB / 49MM, I70WB / 49MM",Units: R8,05/15/2024,2024-05-15 12:55:00
12:50 pm,VEHICLE ACCIDENT - BLS,"I70WB / 49MM, I70WB / 49MM","Units: E121, E82, R2, A89",05/15/2024,2024-05-15 12:50:00
1:04 pm,VEHICLE FIRE REPORTED OUT,5800 BLOCK BURIN ST,"Radio: 9C Units: E331, FS15",05/15/2024,2024-05-15 13:04:00
1:56 pm,VEHICLE ACCIDENT - BLS,12000 BLOCK OLD NATIONAL PIKE,"Radio: 9B Units: A159, E152",05/15/2024,2024-05-15 13:56:00
2:31 pm,VEHICLE ACCIDENT - BLS,DETRICK RD / OLD NATIONAL PIKE,Radio: 9B Units: R15,05/15/2024,2024-05-15 14:31:00
2:30 pm,VEHICLE ACCIDENT - BLS,DETRICK RD / OLD NATIONAL PIKE,"Radio: 9B Units: A159, E152",05/15/2024,2024-05-15 14:30:00
3:50 pm,WIRES DOWN OR ARCING,"200 BLOCK KNOXVILLE RD, IFO",Radio: 9C Units: BR55,05/15/2024,2024-05-15 15:50:00
4:00 pm,VEHICLE ACCIDENT - BLS,FINGERBOARD RD / URBANA CHURCH PASS,"Radio: 9B Units: A239, E232",05/15/2024,2024-05-15 16:00:00
4:23 pm,VEHICLE ACCIDENT - ALS,13200 BLOCK OLD ANNAPOLIS RD,"Radio: 9D Units: EMS901, FS15",05/15/2024,2024-05-15 16:23:00
4:37 pm,VEHICLE ACCIDENT - BLS,OLD ANNAPOLIS RD / BOTTOM RD,Radio: 9D Units: A159,05/15/2024,2024-05-15 16:37:00
5:28 pm,VEHICLE ACCIDENT - ENTRAPMENT,WOODSBORO PIKE / GLADE BLVD,"Radio: 9D Units: E111, R2, A249, ALS29, BC902, EMS902",05/15/2024,2024-05-15 17:28:00
6:15 pm,VEHICLE FIRE,"I70WB / MONOCACY BLVD, I70WB / MONOCACY BLVD","Radio: 9C Units: E331, E31, FS33",05/15/2024,2024-05-15 18:15:00
7:37 pm,VEHICLE ACCIDENT - BLS,"RT17 / BROWNSVILLE PASS RD, RT17 / BROWNSVILLE PASS RD",Units: RE52,05/15/2024,2024-05-15 19:37:00
7:35 pm,VEHICLE ACCIDENT - BLS,"RT17 / BROWNSVILLE PASS RD, RT17 / BROWNSVILLE PASS RD","Units: A196, T5, FS05",05/15/2024,2024-05-15 19:35:00
7:32 pm,HOUSE FIRE,500 BLOCK CARROLLTON DR,"Radio: 9D Units: E31, PE23, E12, E501, PE311, R2, TW4, A39, ALS2, BC901, BC902, SAF901",05/15/2024,2024-05-15 19:32:00
8:26 pm,VEHICLE ACCIDENT - BLS,"I70WB / 45MM, I70WB / 45MM",Units: RE74,05/15/2024,2024-05-15 20:26:00
8:25 pm,VEHICLE ACCIDENT - BLS,"I70WB / 45MM, I70WB / 45MM","Units: E121, E72, R8, A89, A78",05/15/2024,2024-05-15 20:25:00
10:39 pm,WIRES DOWN OR ARCING,6100 BLOCK MOUNTAINDALE RD,Units: EK224,05/15/2024,2024-05-15 22:39:00
11:37 pm,MUTUAL AID,100 BLOCK E BROADWAY,Units: T5,05/15/2024,2024-05-15 23:37:00
12:50 am,COMMERCIAL FIRE ALARM,"100 BLOCK HOLLING DR, EAST OF MARKET APARTMENTS","Units: TW4, FS02",05/16/2024,2024-05-16 00:50:00
2:15 am,VEHICLE FIRE,DETRICK RD / SHERWOOD FOREST DR,Units: E152,05/16/2024,2024-05-16 02:15:00
4:49 am,PEDESTRIAN STRUCK,NEW DESIGN RD / FOXCROFT DR,"Units: A318, ALS31, PE311, EMS901",05/16/2024,2024-05-16 04:49:00
12:48 am,GAS LEAK INSIDE,"100 BLOCK HOLLING DR, Apt/Unit:301, EAST OF MARKET APARTMENTS",Units: E31,05/16/2024,2024-05-16 00:48:00
6:37 am,COMMERCIAL FIRE ALARM,"6400 BLOCK ENGLISH MUFFIN WAY, GOODWILL","Radio: 9C Units: PE311, TW4",05/16/2024,2024-05-16 06:37:00
8:13 am,COMMERCIAL FIRE ALARM,"7300 BLOCK EXECUTIVE WAY, LIFE TECH","Radio: 9C Units: PE311, TW4",05/16/2024,2024-05-16 08:13:00
9:39 am,COMMERCIAL FIRE ALARM,"100 BLOCK WATER ST, KOUNTRY KITCHEN","Radio: 9C Units: E102, Q11",05/16/2024,2024-05-16 09:39:00
1:37 pm,VEHICLE ACCIDENT - BLS,"4500 BLOCK DEER SPRING RD, WLR DISTRIBUTION",Radio: 9B Units: E72,05/16/2024,2024-05-16 13:37:00
1:34 pm,VEHICLE ACCIDENT - BLS,"4500 BLOCK DEER SPRING RD, WLR DISTRIBUTION","Radio: 9B Units: A78, RE74",05/16/2024,2024-05-16 13:34:00
1:45 pm,HELICOPTER LANDING ZONE,"100 BLOCK E MAIN ST, THURMONT CARNIVAL GROUNDS",Units: R10,05/16/2024,2024-05-16 13:45:00
1:58 pm,HELICOPTER LANDING ZONE,"100 BLOCK E MAIN ST, THURMONT CARNIVAL GROUNDS",Units: E102,05/16/2024,2024-05-16 13:58:00
2:30 pm,VEHICLE FIRE,"I70EB / 65MM, I70EB / 65MM",Radio: 9C Units: E152,05/16/2024,2024-05-16 14:30:00
3:11 pm,ELEVATOR MALFUNCTION,"100 BLOCK MARTHA MASON ST, MIDDLETOWN MIDDLE SCHOOL","Radio: 9C Units: E72, R20",05/16/2024,2024-05-16 15:11:00
3:14 pm,ELEVATOR MALFUNCTION,"100 BLOCK MARTHA MASON ST, MIDDLETOWN MIDDLE SCHOOL",Radio: 9C Units: E72,05/16/2024,2024-05-16 15:14:00
3:12 pm,ELEVATOR MALFUNCTION,"100 BLOCK MARTHA MASON ST, MIDDLETOWN MIDDLE SCHOOL",Radio: 9C Units: RE74,05/16/2024,2024-05-16 15:12:00
5:08 pm,COMMERCIAL FIRE ALARM,"300 BLOCK E LINCOLN AVE, DAUGHTERS OF CHARITY CONVENT HOUSE",Radio: 9C Units: E61,05/16/2024,2024-05-16 17:08:00
5:04 pm,RESIDENTIAL FIRE ALARM (SINGLE FAMILY RESD/ MOBILE HOME),5500 BLOCK YOUNG FAMILY TRL W,Radio: 9C Units: E141,05/16/2024,2024-05-16 17:04:00
5:02 pm,MUTUAL AID,1300 BLOCK S MAIN ST,Units: A159,05/16/2024,2024-05-16 17:02:00
5:51 pm,RESIDENTIAL FIRE ALARM (SINGLE FAMILY RESD/ MOBILE HOME),500 BLOCK SWALLOWTAIL DR,"Units: E121, FS01",05/16/2024,2024-05-16 17:51:00
6:22 pm,COMMERCIAL FIRE ALARM,100 BLOCK E FIFTH ST,"Radio: 9C Units: PE23, TW4",05/16/2024,2024-05-16 18:22:00
6:36 pm,COMMERCIAL FIRE ALARM,"5600 BLOCK BUCKEYSTOWN PIKE, DAYS INN","Radio: 9C Units: PE311, TW4",05/16/2024,2024-05-16 18:36:00
6:56 pm,CHECK UP AFTER ACCIDENT - POLICE ON SCENE,WOODSBORO PIKE / CRUM RD,"Radio: 9B Units: A247, A169, E111",05/16/2024,2024-05-16 18:56:00
7:51 pm,VEHICLE ACCIDENT - BLS,"RT15SB / RODDY RD, RT15SB / RODDY RD",Radio: 9B Units: E102,05/16/2024,2024-05-16 19:51:00
7:49 pm,VEHICLE ACCIDENT - BLS,"RT15SB / RODDY RD, RT15SB / RODDY RD","Radio: 9B Units: A309, R10",05/16/2024,2024-05-16 19:49:00
8:42 pm,SERVICE CALL,3900 BLOCK WISTMAN LN,Units: E82,05/16/2024,2024-05-16 20:42:00
8:40 pm,RESIDENTIAL FIRE ALARM (SINGLE FAMILY RESD/ MOBILE HOME),1200 BLOCK LAWLER DR,Radio: 9C Units: E291,05/16/2024,2024-05-16 20:40:00
9:15 pm,GAS LEAK INSIDE,"700 BLOCK HEATHER RIDGE DR, Apt/Unit:K, AMBERTOWN CONDOS #700 BLOCK","Radio: 9C Units: PE23, E501, R2",05/16/2024,2024-05-16 21:15:00
11:07 pm,SERVICE CALL,2000 BLOCK SUMNER DR,Units: E291,05/16/2024,2024-05-16 23:07:00
12:58 am,FLOODING CONDITION,6700 BLOCK BALLENGER RUN BLVD,Units: PE311,05/17/2024,2024-05-17 00:58:00
5:16 am,RESIDENTIAL FIRE ALARM (SINGLE FAMILY RESD/ MOBILE HOME),8000 BLOCK RUNNYMEADE DR,Units: E291,05/17/2024,2024-05-17 05:16:00
6:57 am,RESIDENTIAL FIRE ALARM (SINGLE FAMILY RESD/ MOBILE HOME),11100 BLOCK MOUNTAIN VIEW LN,Radio: 9C Units: E251,05/17/2024,2024-05-17 06:57:00
7:48 am,VEHICLE ACCIDENT - BLS,3000 BLOCK VENTRIE CT,"Radio: 9B Units: A89, R8",05/17/2024,2024-05-17 07:48:00
10:05 am,ODOR OF SMOKE INSIDE,"5300 BLOCK PUBLIC SAFETY PL, PUBLIC SAFETY TRAINING CENTER","Units: E31, E331, TW4",05/17/2024,2024-05-17 10:05:00
10:01 am,GAS LEAK INSIDE,"5300 BLOCK PUBLIC SAFETY PL, PUBLIC SAFETY TRAINING CENTER","Units: E31, E331, TW4",05/17/2024,2024-05-17 10:01:00
10:16 am,UNKNOWN ODOR INSIDE,"5300 BLOCK PUBLIC SAFETY PL, PUBLIC SAFETY TRAINING CENTER","Units: E31, E331, TW4",05/17/2024,2024-05-17 10:16:00
10:44 am,COMMERCIAL FIRE ALARM,400 BLOCK E SEVENTH ST,"Radio: 9C Units: E31, TW4",05/17/2024,2024-05-17 10:44:00
10:40 am,PEDESTRIAN STRUCK,"1000 BLOCK N MARKET ST, YMCA FREDERICK","Radio: 9D Units: A29, ALS29, R2, EMS902",05/17/2024,2024-05-17 10:40:00
12:30 pm,VEHICLE FIRE,"RT340EB / MOUNT ZION RD, RT340EB / MOUNT ZION RD",Radio: 9C Units: U20,05/17/2024,2024-05-17 12:30:00
12:25 pm,VEHICLE FIRE,"RT340EB / MOUNT ZION RD, RT340EB / MOUNT ZION RD","Radio: 9C Units: E201, E31",05/17/2024,2024-05-17 12:25:00
12:49 pm,RESIDENTIAL FIRE ALARM (SINGLE FAMILY RESD/ MOBILE HOME),4400 BLOCK OLD NATIONAL PIKE,Radio: 9C Units: E121,05/17/2024,2024-05-17 12:49:00
3:44 pm,GAS LEAK INSIDE,5900 BLOCK KRANTZ DR,"Radio: 9C Units: E31, E12, TW4",05/17/2024,2024-05-17 15:44:00
3:50 pm,GAS LEAK INSIDE,5900 BLOCK KRANTZ DR,Units: CMD3,05/17/2024,2024-05-17 15:50:00
6:04 pm,INVESTIGATION,7700 BLOCK HOLLOW RD,Units: E121,05/17/2024,2024-05-17 18:04:00
6:17 pm,INVESTIGATION,"RT15NB / 32MM, RT15NB / 32MM",Radio: 9C Units: E102,05/17/2024,2024-05-17 18:17:00
6:16 pm,INVESTIGATION,"RT15NB / 32MM, RT15NB / 32MM",Units: BR106,05/17/2024,2024-05-17 18:16:00
7:02 pm,VEHICLE ACCIDENT - ALS,"I270SB / DOCTOR PERRY RD, I270SB / DOCTOR PERRY RD","Radio: 9D Units: E232, R2, A239, ALS23, EMS901",05/17/2024,2024-05-17 19:02:00
9:44 pm,RESIDENTIAL FIRE ALARM (SINGLE FAMILY RESD/ MOBILE HOME),14900 BLOCK OLD CAMP AIRY RD,Units: E102,05/17/2024,2024-05-17 21:44:00
10:55 pm,RESIDENTIAL FIRE ALARM (SINGLE FAMILY RESD/ MOBILE HOME),5800 BLOCK BUTTERFLY LN,Radio: 9C Units: E12,05/17/2024,2024-05-17 22:55:00
12:29 am,COMMERCIAL FIRE ALARM,"300 BLOCK BALLENGER CENTER DR, Apt/Unit:130, WOODSPRING SUITES","Radio: 9C Units: PE311, TW4",05/18/2024,2024-05-18 00:29:00
8:11 am,COMMERCIAL FIRE ALARM,"100 BLOCK WATER ST, KOUNTRY KITCHEN","Radio: 9C Units: E102, Q11",05/18/2024,2024-05-18 08:11:00
9:08 am,VEHICLE ACCIDENT - BLS,"I70EB / BILL MOXLEY RD, PH2 LOCATION","Units: E152, R15, A159",05/18/2024,2024-05-18 09:08:00
10:14 am,STRUCTURAL COLLAPSE,5500 BLOCK HAYLOFT CT,"Units: E201, E121, R20, TW4, HM33, TR29, A209, ALS20, SAF901, EMS902",05/18/2024,2024-05-18 10:14:00
4:44 pm,COMMERCIAL FIRE ALARM,"1000 BLOCK W PATRICK ST, CARE VETERINARY CENTER",Units: E31,05/18/2024,2024-05-18 16:44:00
4:40 pm,COMMERCIAL FIRE ALARM,"1000 BLOCK W PATRICK ST, CARE VETERINARY CENTER","Units: E12, TW4",05/18/2024,2024-05-18 16:40:00
5:58 pm,VEHICLE ACCIDENT - ALS,KEY PKWY / OLD CAMP RD,"Units: A19, ALS2, E12, EMS902",05/18/2024,2024-05-18 17:58:00
6:44 pm,UNKNOWN ODOR INSIDE,2500 BLOCK MONUMENT RD,Radio: 9C Units: RE74,05/18/2024,2024-05-18 18:44:00
6:42 pm,UNKNOWN ODOR INSIDE,2500 BLOCK MONUMENT RD,"Radio: 9C Units: E82, E72, E212",05/18/2024,2024-05-18 18:42:00
10:17 pm,BRUSH FIRE THREATENING A STRUCTURE,6500 BLOCK SCHNEIDER DR,"Radio: 9C Units: E201, E121, T5, K7, A78, BR75, SAF901, FS07",05/18/2024,2024-05-18 22:17:00
10:16 pm,BRUSH FIRE THREATENING A STRUCTURE,6500 BLOCK SCHNEIDER DR,Radio: 9C Units: E72,05/18/2024,2024-05-18 22:16:00
10:13 pm,OUTSIDE FIRE,6500 BLOCK SCHNEIDER DR,Radio: 9C Units: BR75,05/18/2024,2024-05-18 22:13:00
10:22 pm,BRUSH FIRE THREATENING A STRUCTURE,6500 BLOCK SCHNEIDER DR,Radio: 9C Units: C20,05/18/2024,2024-05-18 22:22:00
10:58 pm,RESIDENTIAL FIRE ALARM (SINGLE FAMILY RESD/ MOBILE HOME),12300 BLOCK TANEYTOWN PIKE,Radio: 9C Units: E61,05/18/2024,2024-05-18 22:58:00
3:05 am,VEHICLE ACCIDENT - BLS,CLARKSBURG RD / WOODVIEW DR,"Units: A259, E251",05/19/2024,2024-05-19 03:05:00
4:45 am,VEHICLE ACCIDENT - BLS,RT15 @ CLAY ST HWY / CLAY ST,"Radio: 9B Units: E281, R20, A149",05/19/2024,2024-05-19 04:45:00
6:32 am,GAS LEAK OUTSIDE,"6800 BLOCK ENGLISH MUFFIN WAY, ARC3",Radio: 9C Units: PE311,05/19/2024,2024-05-19 06:32:00
6:43 am,GAS LEAK OUTSIDE,"6800 BLOCK ENGLISH MUFFIN WAY, ARC3",Radio: 9C Units: HM33,05/19/2024,2024-05-19 06:43:00
7:10 am,GAS LEAK OUTSIDE,"6800 BLOCK ENGLISH MUFFIN WAY, ARC3",Radio: 9C Units: SOBC900,05/19/2024,2024-05-19 07:10:00
7:09 am,GAS LEAK OUTSIDE,"6800 BLOCK ENGLISH MUFFIN WAY, ARC3",Radio: 9C Units: CMD31,05/19/2024,2024-05-19 07:09:00
7:45 am,WIRES DOWN OR ARCING,10000 BLOCK MOUNT TABOR RD,Radio: 9C Units: E82,05/19/2024,2024-05-19 07:45:00
7:44 am,WIRES DOWN OR ARCING,10000 BLOCK MOUNT TABOR RD,Radio: 9C Units: BR85,05/19/2024,2024-05-19 07:44:00
10:48 am,COMMERCIAL FIRE ALARM,"2400 BLOCK ELLSWORTH WAY, Apt/Unit:1-C, LAKE TREE CONDOS",Units: E11,05/19/2024,2024-05-19 10:48:00
11:25 am,COMMERCIAL FIRE ALARM,200 BLOCK W PATRICK ST,"Radio: 9C Units: E31, TW4",05/19/2024,2024-05-19 11:25:00
11:52 am,INVESTIGATION,"7800 BLOCK WORMANS MILL RD, WEGMANS",Radio: 9C Units: E291,05/19/2024,2024-05-19 11:52:00
12:07 pm,RESIDENTIAL FIRE ALARM (SINGLE FAMILY RESD/ MOBILE HOME),200 BLOCK E SIXTH ST,Radio: 9C Units: PE23,05/19/2024,2024-05-19 12:07:00
1:16 pm,GAS LEAK INSIDE,2100 BLOCK KINGS FORREST TRAIL,Units: R15,05/19/2024,2024-05-19 13:16:00
1:41 pm,RESIDENTIAL FIRE ALARM (SINGLE FAMILY RESD/ MOBILE HOME),1800 BLOCK FAIRWAY LN,"Units: E11, FS29",05/19/2024,2024-05-19 13:41:00
1:41 pm,INVESTIGATION,"7800 BLOCK WORMANS MILL RD, WEGMANS",Units: E291,05/19/2024,2024-05-19 13:41:00
2:34 pm,VEHICLE ACCIDENT - ROLLOVER,100 BLOCK BLK RAMP RT15-34100 BLOCKEB TO I7100 BLOCKWB RAMP,"Radio: 9D Units: E11, R2, A38, ALS31, BC901, EMS901, FS31",05/19/2024,2024-05-19 14:34:00
2:43 pm,VEHICLE ACCIDENT - ROLLOVER,100 BLOCK BLK RAMP RT15-34100 BLOCKEB TO RT15NB RAMP,Units: BC901,05/19/2024,2024-05-19 14:43:00
2:42 pm,VEHICLE ACCIDENT - ROLLOVER,100 BLOCK BLK RAMP RT15-34100 BLOCKEB TO RT15NB RAMP,Units: R2,05/19/2024,2024-05-19 14:42:00
2:41 pm,VEHICLE ACCIDENT - ROLLOVER,100 BLOCK BLK RAMP RT15-34100 BLOCKEB TO RT15NB RAMP,"Units: E31, R20, A39, ALS4, EMS901, FS03",05/19/2024,2024-05-19 14:41:00
3:37 pm,VEHICLE ACCIDENT - BLS,"I70EB / HOLLOW RD, I70EB / HARMONY RD","Radio: 9B Units: A89, R8",05/19/2024,2024-05-19 15:37:00
3:36 pm,COMMERCIAL FIRE ALARM,2000 BLOCK FAUNA DR,Radio: 9C Units: E291,05/19/2024,2024-05-19 15:36:00
3:46 pm,VEHICLE ACCIDENT - ALS,"I70EB / HOLLOW RD, I70EB / HARMONY RD","Radio: 9B Units: ALS8, EMS901",05/19/2024,2024-05-19 15:46:00
4:01 pm,VEHICLE ACCIDENT - ROLLOVER,"I70EB / LINGANORE RD, I70EB / LINGANORE RD","Radio: 9D Units: E331, E152, R2, A339, A159, ALS4, BC901, EMS901",05/19/2024,2024-05-19 16:01:00
4:43 pm,VEHICLE FIRE,"RT340WB / RT17, RT340WB / RT17","Radio: 9C Units: E201, RE52",05/19/2024,2024-05-19 16:43:00
6:19 pm,VEHICLE ACCIDENT - BLS,GLADE BLVD / GLADE CT,"Radio: 9B Units: A249, E111",05/19/2024,2024-05-19 18:19:00
6:16 pm,WIRES DOWN OR ARCING,INDIAN SPRINGS RD / KORRELL LN,Radio: 9C Units: E291,05/19/2024,2024-05-19 18:16:00
6:23 pm,RESIDENTIAL FIRE ALARM (SINGLE FAMILY RESD/ MOBILE HOME),1200 BLOCK ENFIELD FARM LN,Units: RE52,05/19/2024,2024-05-19 18:23:00
6:57 pm,HOUSE FIRE,13500 BLOCK PENN SHOP RD,Radio: 9C Units: CMD25,05/19/2024,2024-05-19 18:57:00
6:56 pm,HOUSE FIRE,13500 BLOCK PENN SHOP RD,"Radio: 9C Units: E152, E331, R2, K33, SAF901",05/19/2024,2024-05-19 18:56:00
6:50 pm,ELECTRICAL HAZARD INSIDE,13500 BLOCK PENN SHOP RD,"Radio: 9C Units: E251, R15, CCK1",05/19/2024,2024-05-19 18:50:00
7:04 pm,PEDESTRIAN STRUCK,8900 BLOCK OPOSSUMTOWN PIKE,"Radio: 9D Units: A38, ALS29, E291, EMS902",05/19/2024,2024-05-19 19:04:00
7:27 pm,VEHICLE ACCIDENT - BLS,"RT15NB / W PATRICK ST, RT15NB / W PATRICK ST","Units: E31, PE23, R2, A39, A19",05/19/2024,2024-05-19 19:27:00
11:40 pm,RESIDENTIAL FIRE ALARM (SINGLE FAMILY RESD/ MOBILE HOME),9900 BLOCK ARAPAHOE RD,Radio: 9C Units: E152,05/19/2024,2024-05-19 23:40:00
1:56 am,VEHICLE ACCIDENT - BLS,"I70WB / EXIT 42 (RT17), I70WB / EXIT 42",Units: RE74,05/20/2024,2024-05-20 01:56:00
1:53 am,VEHICLE ACCIDENT - BLS,"I70WB / EXIT 42 (RT17), I70WB / EXIT 42","Units: E72, R8, A89",05/20/2024,2024-05-20 01:53:00
7:09 am,CHECK UP AFTER ACCIDENT - POLICE ON SCENE,11000 BLOCK DAYSVILLE RD,"Radio: 9B Units: A179, E172",05/20/2024,2024-05-20 07:09:00
7:12 am,CHECK UP AFTER ACCIDENT - POLICE ON SCENE,11000 BLOCK DAYSVILLE RD,Radio: 9B Units: RE171,05/20/2024,2024-05-20 07:12:00
9:41 am,COMMERCIAL FIRE ALARM,"9200 BLOCK DEVILBISS BRIDGE RD, HERITAGE FARM PARK","Radio: 9C Units: E111, Q11",05/20/2024,2024-05-20 09:41:00
11:23 am,UNIT TRANSFER TO OTHER STATION,"26300 BLOCK RIDGE RD, STATION MC713 - DAMASCUS",Units: A159,05/20/2024,2024-05-20 11:23:00
11:19 am,UNIT TRANSFER TO OTHER STATION,"26300 BLOCK RIDGE RD, STATION MC713 - DAMASCUS",Units: E152,05/20/2024,2024-05-20 11:19:00
11:59 am,MOTORCYCLE ACCIDENT,"RT15NB / OLD FREDERICK RD (EMMITSBURG), RT15NB / OLD FREDERICK RD","Radio: 9D Units: A68, ALS30, R6, EMS902",05/20/2024,2024-05-20 11:59:00
11:58 am,VEHICLE ACCIDENT - BLS,"RT15 / S SETON AVE, RT15 / S SETON AVE","Radio: 9B Units: A68, EK64",05/20/2024,2024-05-20 11:58:00
12:03 pm,MOTORCYCLE ACCIDENT,"RT15NB / OLD FREDERICK RD (EMMITSBURG), RT15NB / OLD FREDERICK RD",Radio: 9D Units: EK64,05/20/2024,2024-05-20 12:03:00
12:17 pm,RESIDENTIAL FIRE ALARM (SINGLE FAMILY RESD/ MOBILE HOME),6500 BLOCK NEWTON DR,"Radio: 9C Units: PE311, FS31",05/20/2024,2024-05-20 12:17:00
12:36 pm,RESIDENTIAL FIRE ALARM (SINGLE FAMILY RESD/ MOBILE HOME),6500 BLOCK NEWTON DR,Radio: 9C Units: R14,05/20/2024,2024-05-20 12:36:00
12:39 pm,RESIDENTIAL FIRE ALARM (SINGLE FAMILY RESD/ MOBILE HOME),6500 BLOCK NEWTON DR,Radio: 9C Units: CMD31,05/20/2024,2024-05-20 12:39:00
1:07 pm,RESIDENTIAL FIRE ALARM (SINGLE FAMILY RESD/ MOBILE HOME),6500 BLOCK NEWTON DR,Radio: 9C Units: HM33,05/20/2024,2024-05-20 13:07:00
1:29 pm,OUTSIDE FIRE,BELLS LN / BALTIMORE RD,Radio: 9C Units: K33,05/20/2024,2024-05-20 13:29:00
1:28 pm,OUTSIDE FIRE,BELLS LN / BALTIMORE RD,"Radio: 9C Units: BR35, FS33",05/20/2024,2024-05-20 13:28:00
2:18 pm,MUTUAL AID,20200 BLOCK THUNDERHEAD WAY,Units: K23,05/20/2024,2024-05-20 14:18:00
2:12 pm,RESIDENTIAL FIRE ALARM (SINGLE FAMILY RESD/ MOBILE HOME),5700 BLOCK MORLAND DR S,Radio: 9C Units: E281,05/20/2024,2024-05-20 14:12:00
2:43 pm,UNIT TRANSFER TO OTHER STATION,"22600 BLOCK GATEWAY CENTER DR, Apt/Unit:300, STATION MC735 - CLARKSBURG",Units: E31,05/20/2024,2024-05-20 14:43:00
3:31 pm,COMMERCIAL FIRE ALARM,6200 BLOCK ADELAY CT,"Radio: 9C Units: PE311, TW4",05/20/2024,2024-05-20 15:31:00
3:55 pm,GAS LEAK INSIDE,12900 BLOCK GRIFFIN CIR,Radio: 7A1 Units: E31,05/20/2024,2024-05-20 15:55:00
3:53 pm,MUTUAL AID,12900 BLOCK GRIFFIN CIR,Units: E232,05/20/2024,2024-05-20 15:53:00
4:08 pm,UNIT TRANSFER TO OTHER STATION,"22600 BLOCK GATEWAY CENTER DR, Apt/Unit:300, STATION MC735 - CLARKSBURG",Units: E31,05/20/2024,2024-05-20 16:08:00
4:14 pm,UNIT TRANSFER TO OTHER STATION,"12100 BLOCK DARNESTOWN RD, STATION MC731 - ROCKVILLE",Units: E232,05/20/2024,2024-05-20 16:14:00
4:42 pm,PEDESTRIAN STRUCK,WILSON PL / W SEVENTH ST,"Units: A29, E501, EMS901",05/20/2024,2024-05-20 16:42:00
6:00 pm,CHECK UP AFTER ACCIDENT - POLICE ON SCENE,"5200 BLOCK BUCKEYSTOWN PIKE, PANDA EXPRESS","Units: A319, PE311",05/20/2024,2024-05-20 18:00:00
7:17 pm,RESIDENTIAL FIRE ALARM (SINGLE FAMILY RESD/ MOBILE HOME),2000 BLOCK ROSECRANS CT,Units: E291,05/20/2024,2024-05-20 19:17:00
8:50 pm,MUTUAL AID,400 BLOCK WAYNESBORO PIKE,"Units: A69, R6",05/20/2024,2024-05-20 20:50:00
11:59 pm,COMMERCIAL FIRE ALARM,"1400 BLOCK KEY PKWY, HICKORY HILL APTS","Radio: 9C Units: E11, TW4",05/20/2024,2024-05-20 23:59:00
12:22 am,WIRES DOWN OR ARCING,E SEVENTH ST / N MARKET ST,Radio: 9C Units: PE23,05/21/2024,2024-05-21 00:22:00
5:28 am,CHECK UP AFTER ACCIDENT - POLICE ON SCENE,"I270SB / RT80, I270SB / RT80","Units: E232, A239",05/21/2024,2024-05-21 05:28:00
6:45 am,COMMERCIAL FIRE ALARM,"800 BLOCK MOTTER AVE, Apt/Unit:404, CATOCTIN VIEW APTS","Radio: 9C Units: PE23, TW4, FS02",05/21/2024,2024-05-21 06:45:00
7:08 am,COMMERCIAL FIRE ALARM,"3900 BLOCK DARTMOUTH CT, Apt/Unit:A","Units: E201, TW4, FS20",05/21/2024,2024-05-21 07:08:00
7:19 am,COMMERCIAL FIRE ALARM,"700 BLOCK W PATRICK ST, TRINITY UNITED METHODIST CHURCH","Radio: 9C Units: E31, TW4, FS01",05/21/2024,2024-05-21 07:19:00
7:39 am,COMMERCIAL FIRE ALARM,"7400 BLOCK WILLOW RD, HOMEWOOD AT CRUMLAND","Units: E291, FS29",05/21/2024,2024-05-21 07:39:00
8:06 am,VEHICLE FIRE,"8000 BLOCK REICHS FORD RD, RELIABLE RECYCLING CENTER","Radio: 91D Units: E31, PE23, E331, TW4, A39, BC901, SAF901, FS03",05/21/2024,2024-05-21 08:06:00
8:25 am,VEHICLE ACCIDENT - BLS,"I270NB / NEW DESIGN RD, Apt/Unit:HTTPS://A91.IO/USJ88, I270NB / NEW DESIGN RD",Units: CMD31,05/21/2024,2024-05-21 08:25:00
8:20 am,VEHICLE ACCIDENT - BLS,"I270NB / NEW DESIGN RD, Apt/Unit:HTTPS://A91.IO/USJ88, I270NB / NEW DESIGN RD","Units: PE311, E11, R2, A318, A18, FS31",05/21/2024,2024-05-21 08:20:00
8:19 am,RESIDENTIAL FIRE ALARM (SINGLE FAMILY RESD/ MOBILE HOME),4300 BLOCK SHAMROCK DR,"Units: E251, FS25",05/21/2024,2024-05-21 08:19:00
8:17 am,ILLEGAL OPEN BURNING - NON EMERGENCY RESPONSE,100 BLOCK E GREEN ST,Radio: 9C Units: RE74,05/21/2024,2024-05-21 08:17:00
8:17 am,ILLEGAL OPEN BURNING - NON EMERGENCY RESPONSE,100 BLOCK E GREEN ST,"Radio: 9C Units: BR75, FS07",05/21/2024,2024-05-21 08:17:00
8:16 am,COMMERCIAL FIRE ALARM,"1900 BLOCK LOCKHOUSE DR, POINT OF ROCKS SURGERY CENTER","Radio: 9C Units: E281, T5, FS28",05/21/2024,2024-05-21 08:16:00
9:08 am,COMMERCIAL FIRE ALARM,"1600 BLOCK BOWMANS FARM RD, MONOCACY CENTER EAST","Radio: 9C Units: E331, TW4, FS03",05/21/2024,2024-05-21 09:08:00
9:17 am,COMMERCIAL FIRE ALARM,"7400 BLOCK WILLOW RD, HOMEWOOD AT CRUMLAND","Units: E291, TW4, FS29",05/21/2024,2024-05-21 09:17:00
9:37 am,COMMERCIAL FIRE ALARM,"12000 BLOCK OLD ANNAPOLIS RD, LINGANORE HIGH SCHOOL","Radio: 9C Units: E172, Q11, FS17",05/21/2024,2024-05-21 09:37:00
9:44 am,COMMERCIAL FIRE ALARM,"12000 BLOCK OLD ANNAPOLIS RD, LINGANORE HIGH SCHOOL","Units: E172, Q11",05/21/2024,2024-05-21 09:44:00
10:31 am,GAS LEAK OUTSIDE,6900 BLOCK ENGLISH MUFFIN WAY,Radio: 9C Units: PE311,05/21/2024,2024-05-21 10:31:00
10:42 am,GAS LEAK INSIDE,6900 BLOCK ENGLISH MUFFIN WAY,Radio: 9C Units: CMD31,05/21/2024,2024-05-21 10:42:00
10:42 am,VEHICLE ACCIDENT - BLS,4300 BLOCK BALLENGER CREEK PIKE,"Radio: 9B Units: A149, E141",05/21/2024,2024-05-21 10:42:00
10:40 am,GAS LEAK INSIDE,6900 BLOCK ENGLISH MUFFIN WAY,"Radio: 9C Units: E31, TW4",05/21/2024,2024-05-21 10:40:00
11:35 am,LIGHT SMOKE CONDITIONS,"FIDDLERS GREEN AT EDENTON, FIDDLERS GREEN AT EDENTON","Radio: 9C Units: PE311, E31, TW4",05/21/2024,2024-05-21 11:35:00
11:42 am,LIGHT SMOKE CONDITIONS,"FIDDLERS GREEN AT EDENTON, FIDDLERS GREEN AT EDENTON",Radio: 9C Units: CMD31,05/21/2024,2024-05-21 11:42:00
12:10 pm,COMMERCIAL FIRE ALARM,"5300 BLOCK PUBLIC SAFETY PL, TEST TEST TEST","Units: E31, TW4",05/21/2024,2024-05-21 12:10:00
12:02 pm,COMMERCIAL FIRE ALARM,"5300 BLOCK PUBLIC SAFETY PL, TEST TEST TEST",Units: E31,05/21/2024,2024-05-21 12:02:00
12:17 pm,COMMERCIAL FIRE ALARM,"5300 BLOCK PUBLIC SAFETY PL, TEST TEST TEST","Units: E31, TW4",05/21/2024,2024-05-21 12:17:00
12:13 pm,COMMERCIAL FIRE ALARM,"5300 BLOCK PUBLIC SAFETY PL, TEST TEST TEST","Units: E31, TW4",05/21/2024,2024-05-21 12:13:00
12:39 pm,MOTORCYCLE ACCIDENT,9300 BLOCK DUBLIN RD,"Radio: 9D Units: A249, ALS29, E111, EMS902",05/21/2024,2024-05-21 12:39:00
12:46 pm,MOTORCYCLE ACCIDENT,9300 BLOCK DUBLIN RD,Radio: 9D Units: CMD11,05/21/2024,2024-05-21 12:46:00
12:43 pm,COMMERCIAL FIRE ALARM,100 BLOCK E CHURCH ST,"Radio: 9C Units: E31, TW4",05/21/2024,2024-05-21 12:43:00
1:01 pm,COMMERCIAL FIRE ALARM,"5300 BLOCK PUBLIC SAFETY PL, PUBLIC SAFETY TRAINING CENTER","Units: E31, TW4",05/21/2024,2024-05-21 13:01:00
1:01 pm,SERVICE CALL,"5300 BLOCK PUBLIC SAFETY PL, PUBLIC SAFETY TRAINING CENTER",Units: E31,05/21/2024,2024-05-21 13:01:00
3:19 pm,INVESTIGATION,7700 BLOCK HOLLOW RD,Radio: 9C Units: E121,05/21/2024,2024-05-21 15:19:00
4:06 pm,COMMERCIAL FIRE ALARM,"5300 BLOCK PUBLIC SAFETY PL, PUBLIC SAFETY TRAINING CENTER","Units: E31, TW4",05/21/2024,2024-05-21 16:06:00
4:05 pm,COMMERCIAL FIRE ALARM,"5300 BLOCK PUBLIC SAFETY PL, PUBLIC SAFETY TRAINING CENTER","Units: E31, TW4",05/21/2024,2024-05-21 16:05:00
4:04 pm,SERVICE CALL,"5300 BLOCK PUBLIC SAFETY PL, PUBLIC SAFETY TRAINING CENTER",Units: E31,05/21/2024,2024-05-21 16:04:00
4:20 pm,VEHICLE ACCIDENT - ENTRAPMENT,"RT15 / MOUNTVILLE RD, RT15 / MOUNTVILLE RD",Radio: 9D Units: E281,05/21/2024,2024-05-21 16:20:00
4:19 pm,COMMERCIAL FIRE ALARM,"5300 BLOCK PUBLIC SAFETY PL, PSTF ANNEX","Units: E31, TW4",05/21/2024,2024-05-21 16:19:00
4:16 pm,VEHICLE ACCIDENT - ENTRAPMENT,"RT15 / MOUNTVILLE RD, RT15 / MOUNTVILLE RD","Units: EMS901, ALS20",05/21/2024,2024-05-21 16:16:00
4:15 pm,VEHICLE ACCIDENT - BLS,"RT15 / MOUNTVILLE RD, RT15 / MOUNTVILLE RD","Units: E201, R20, A209",05/21/2024,2024-05-21 16:15:00
4:23 pm,APPLIANCE MALFUNCTION,"5300 BLOCK PUBLIC SAFETY PL, PSTF ANNEX","Units: E31, E331, TW4",05/21/2024,2024-05-21 16:23:00
4:37 pm,COMMERCIAL FIRE ALARM,"5300 BLOCK PUBLIC SAFETY PL, PUBLIC SAFETY TRAINING CENTER","Units: E31, TW4",05/21/2024,2024-05-21 16:37:00
4:35 pm,COMMERCIAL FIRE ALARM,"5300 BLOCK PUBLIC SAFETY PL, PUBLIC SAFETY TRAINING CENTER","Units: E31, TW4",05/21/2024,2024-05-21 16:35:00
4:29 pm,APPLIANCE MALFUNCTION,"5300 BLOCK PUBLIC SAFETY PL, PUBLIC SAFETY TRAINING CENTER","Units: E31, E331, TW4",05/21/2024,2024-05-21 16:29:00
4:46 pm,COMMERCIAL FIRE ALARM,"100 BLOCK W MAIN ST, ZION LUTHERAN CHURCH",Radio: 9C Units: RE74,05/21/2024,2024-05-21 16:46:00
4:44 pm,COMMERCIAL FIRE ALARM,"100 BLOCK W MAIN ST, ZION LUTHERAN CHURCH","Radio: 9C Units: E72, TW4",05/21/2024,2024-05-21 16:44:00
4:38 pm,APPLIANCE MALFUNCTION,"5300 BLOCK PUBLIC SAFETY PL, PUBLIC SAFETY TRAINING CENTER","Units: E31, E331, TW4",05/21/2024,2024-05-21 16:38:00
5:17 pm,PEDESTRIAN STRUCK,"2400 BLOCK MONOCACY BLVD, WALMART","Radio: 9D Units: A249, ALS29, E291, EMS902",05/21/2024,2024-05-21 17:17:00
6:25 pm,ODOR OF SMOKE INSIDE,"300 BLOCK CORMORANT PL, Apt/Unit:1103, THE RETREAT AT MARKET SQUARE","Radio: 9C Units: E291, PE23, R2",05/21/2024,2024-05-21 18:25:00
6:34 pm,ODOR OF SMOKE INSIDE,"300 BLOCK CORMORANT PL, Apt/Unit:1103, THE RETREAT AT MARKET SQUARE",Radio: 9C Units: CMD29,05/21/2024,2024-05-21 18:34:00
6:31 pm,RESIDENTIAL FIRE ALARM (SINGLE FAMILY RESD/ MOBILE HOME),6100 BLOCK COOLSPRING TER S,Radio: 9C Units: K33,05/21/2024,2024-05-21 18:31:00
6:30 pm,RESIDENTIAL FIRE ALARM (SINGLE FAMILY RESD/ MOBILE HOME),6100 BLOCK COOLSPRING TER S,"Radio: 9C Units: E31, FS33",05/21/2024,2024-05-21 18:30:00
7:52 pm,VEHICLE ACCIDENT - HAZMAT,GAS HOUSE PIKE / SANANDREW DR,Units: EMS902,05/21/2024,2024-05-21 19:52:00
7:52 pm,VEHICLE ACCIDENT - HAZMAT,GAS HOUSE PIKE / SANANDREW DR,"Units: E152, E172, R15, K33, HM33, E121, A159, A179, ALS17, BC901, SAF901, EMS900",05/21/2024,2024-05-21 19:52:00
7:49 pm,VEHICLE ACCIDENT - ENTRAPMENT,"1800 BLOCK SHOOKSTOWN RD, EST","Radio: 9D Units: E11, R2, A18, ALS2, BC902, EMS902",05/21/2024,2024-05-21 19:49:00
8:39 pm,FLOODING CONDITION,"600 BLOCK HIMES AVE, Apt/Unit:104, OVERLOOK APTS",Radio: 9C Units: E11,05/21/2024,2024-05-21 20:39:00
8:39 pm,RESIDENTIAL FIRE ALARM (SINGLE FAMILY RESD/ MOBILE HOME),10000 BLOCK PRESTWICH TER,Radio: 9C Units: E152,05/21/2024,2024-05-21 20:39:00
1:41 am,SERVICE CALL,1500 BLOCK LAUREL WOOD WAY,Radio: 9C Units: E291,05/22/2024,2024-05-22 01:41:00
2:53 am,VEHICLE ACCIDENT - BLS,"I70EB / HOLLOW RD, I70EB / HOLLOW RD",Units: RE74,05/22/2024,2024-05-22 02:53:00
2:51 am,VEHICLE ACCIDENT - BLS,"I70EB / HOLLOW RD, I70EB / HOLLOW RD","Units: E72, E121, R8, A89",05/22/2024,2024-05-22 02:51:00
6:50 am,COMMERCIAL FIRE ALARM,"5900 BLOCK QUINN ORCHARD RD, COUNTRY MEADOWS OF FREDERICK #5900 BLOCK","Radio: 9C Units: E31, TW4, FS33",05/22/2024,2024-05-22 06:50:00
7:20 am,VEHICLE FIRE,"RT15NB / RT550, RT15NB / RT77",Radio: 9C Units: E102,05/22/2024,2024-05-22 07:20:00
7:23 am,COMMERCIAL FIRE ALARM,100 BLOCK STEINER WAY,"Radio: 9C Units: E31, TW4",05/22/2024,2024-05-22 07:23:00
7:58 am,MOTORCYCLE ACCIDENT,"5500 BLOCK NEW DESIGN RD, STATION 31","Units: A318, ALS31, PE311, EMS901",05/22/2024,2024-05-22 07:58:00
9:57 am,COMMERCIAL FIRE ALARM,"1000 BLOCK W PATRICK ST, H MART","Radio: 9C Units: E11, TW4",05/22/2024,2024-05-22 09:57:00
11:11 am,BUS ACCIDENT,WOODSBORO PIKE / LIBERTY RD,Units: CMD11,05/22/2024,2024-05-22 11:11:00
11:10 am,BUS ACCIDENT,WOODSBORO PIKE / LIBERTY RD,Units: BC902,05/22/2024,2024-05-22 11:10:00
11:08 am,BUS ACCIDENT,WOODSBORO PIKE / LIBERTY RD,Units: Q11,05/22/2024,2024-05-22 11:08:00
11:08 am,BUS ACCIDENT,WOODSBORO PIKE / LIBERTY RD,"Units: E111, PE23, R2, RE171, A249, A29, A18, A318, ALS2",05/22/2024,2024-05-22 11:08:00
12:10 pm,CHECK UP AFTER ACCIDENT - POLICE ON SCENE,NEW DESIGN RD / ARBOR DR,"Radio: 9B Units: A318, PE311",05/22/2024,2024-05-22 12:10:00
12:48 pm,TEST CALL,"5300 BLOCK PUBLIC SAFETY PL, PUBLIC SAFETY TRAINING CENTER","Units: E31, TW4, PE23",05/22/2024,2024-05-22 12:48:00
12:53 pm,TEST CALL,"5300 BLOCK PUBLIC SAFETY PL, PUBLIC SAFETY TRAINING CENTER","Units: PE311, E331",05/22/2024,2024-05-22 12:53:00
1:10 pm,VEHICLE ACCIDENT - BLS,WILLOWDALE DR / KEY PKWY,"Radio: 9B Units: A19, E11",05/22/2024,2024-05-22 13:10:00
1:15 pm,VEHICLE ACCIDENT - BLS,S MARKET ST / NEW DESIGN RD,"Radio: 9B Units: A38, E31",05/22/2024,2024-05-22 13:15:00
1:27 pm,MUTUAL AID,38800 BLOCK IRISH CORNER RD,"Units: RE52, T5, A196",05/22/2024,2024-05-22 13:27:00
1:37 pm,BARN FIRE,13300 BLOCK OLD NATIONAL PIKE,Radio: 9D Units: CMD15,05/22/2024,2024-05-22 13:37:00
1:35 pm,BARN FIRE,13300 BLOCK OLD NATIONAL PIKE,"Radio: 9D Units: K17, K23",05/22/2024,2024-05-22 13:35:00
1:29 pm,BARN FIRE,13300 BLOCK OLD NATIONAL PIKE,"Radio: 9D Units: E152, E251, E331, PE23, R15, K33, BC901, SAF901, CCK1",05/22/2024,2024-05-22 13:29:00
1:45 pm,COMMERCIAL FIRE ALARM,"11100 BLOCK HESSONG BRIDGE RD, LEWISTOWN ELEMENTARY SCHOOL","Radio: 9C Units: E291, Q11, EK224",05/22/2024,2024-05-22 13:45:00
3:22 pm,LIGHT SMOKE CONDITIONS,"100 BLOCK E PATRICK ST, CARROLL CREEK PARKING DECK","Units: E31, PE23, TW4, FS03",05/22/2024,2024-05-22 15:22:00
3:56 pm,COMMERCIAL FIRE ALARM,"5100 BLOCK BUCKEYSTOWN PIKE, STATE HIGHWAY ADMINISTRATION","Radio: 9C Units: PE311, TW4",05/22/2024,2024-05-22 15:56:00
4:26 pm,WIRES DOWN OR ARCING,100 BLOCK E B ST,Radio: 9C Units: BR55,05/22/2024,2024-05-22 16:26:00
4:29 pm,WIRES DOWN OR ARCING,100 BLOCK E B ST,Radio: 9C Units: RE52,05/22/2024,2024-05-22 16:29:00
5:28 pm,VEHICLE ACCIDENT - BLS,"4400 BLOCK REELS MILL RD, IFO","Radio: 9B Units: A239, E232",05/22/2024,2024-05-22 17:28:00
5:39 pm,LIGHT SMOKE CONDITIONS,100 BLOCK W MAIN ST,"Radio: 9C Units: E152, E331, TW4",05/22/2024,2024-05-22 17:39:00
5:58 pm,VEHICLE ACCIDENT - BLS,FINGERBOARD RD / PENN SHOP RD,Units: E251,05/22/2024,2024-05-22 17:58:00
5:54 pm,COMMERCIAL FIRE ALARM,"5500 BLOCK BUCKEYSTOWN PIKE, FRANCIS SCOTT KEY MALL","Radio: 9C Units: PE311, TW4",05/22/2024,2024-05-22 17:54:00
6:18 pm,MUTUAL AID,100 BLOCK TOWN CENTER DR,Units: T5,05/22/2024,2024-05-22 18:18:00
7:24 pm,VEHICLE FIRE,"I70WB / RT355, I70WB / RT355","Radio: 9C Units: E31, E23",05/22/2024,2024-05-22 19:24:00
7:55 pm,MOTORCYCLE ACCIDENT,"RT340WB / I70, RT340WB / I70","Radio: 9D Units: E11, R2, A19, PE23, EMS901",05/22/2024,2024-05-22 19:55:00
9:08 pm,HOUSE FIRE,600 BLOCK FRANCIS SCOTT KEY HIGHWAY,Units: EK114,05/22/2024,2024-05-22 21:08:00
9:05 pm,MUTUAL AID,600 BLOCK FRANCIS SCOTT KEY HIGHWAY,"Units: E91, E132, E162, K9, EK134",05/22/2024,2024-05-22 21:05:00
10:46 pm,MUTUAL AID,I270SB / RT109,Units: E232,05/22/2024,2024-05-22 22:46:00
12:39 am,VEHICLE ACCIDENT - ALS,OLD NATIONAL PIKE / GREEN VALLEY RD,Units: EMS901,05/23/2024,2024-05-23 00:39:00
12:36 am,VEHICLE ACCIDENT - BLS,OLD NATIONAL PIKE / GREEN VALLEY RD,"Units: A159, E152",05/23/2024,2024-05-23 00:36:00
8:10 am,VEHICLE ACCIDENT - BLS,"100 BLOCK MONOCACY BLVD, COSTCO STORE","Units: A39, E31",05/23/2024,2024-05-23 08:10:00
9:21 am,WIRES DOWN OR ARCING,10500 BLOCK COOK BROTHERS RD,Radio: 9C Units: E251,05/23/2024,2024-05-23 09:21:00
9:46 am,COMMERCIAL FIRE ALARM,"11100 BLOCK HESSONG BRIDGE RD, LEWISTOWN ELEMENTARY SCHOOL",Units: E291,05/23/2024,2024-05-23 09:46:00
10:43 am,COMMERCIAL FIRE ALARM,"100 BLOCK N MARKET ST, FREDERICK DELIGHTS","Radio: 9C Units: E31, TW4",05/23/2024,2024-05-23 10:43:00
11:44 am,COMMERCIAL FIRE ALARM,"7300 BLOCK BURKITTSVILLE RD, HOLY FAMILY CATHOLIC CHURCH","Units: E72, T5",05/23/2024,2024-05-23 11:44:00
12:44 pm,TEST CALL,"5300 BLOCK PUBLIC SAFETY PL, PUBLIC SAFETY TRAINING CENTER","Units: E31, PE23, TW4",05/23/2024,2024-05-23 12:44:00
12:43 pm,TEST CALL,"5300 BLOCK PUBLIC SAFETY PL, PUBLIC SAFETY TRAINING CENTER","Units: E31, PE23",05/23/2024,2024-05-23 12:43:00
1:09 pm,PEDESTRIAN STRUCK,6800 BLOCK WHISTLING SWAN WAY,"Radio: 9D Units: A159, ALS2, E152, EMS902",05/23/2024,2024-05-23 13:09:00
2:00 pm,ELEVATOR MALFUNCTION,"1300 BLOCK W PATRICK ST, BOSCOVS","Radio: 9C Units: E11, TW4",05/23/2024,2024-05-23 14:00:00
4:32 pm,BUILDING FIRE,"100 BLOCK WAVERLEY DR, ELMWOOD TERRACE APTS","Units: E11, E31, PE23, E121, E331, R2, TW4, A19, ALS2, BC901, SAF901",05/23/2024,2024-05-23 16:32:00
5:32 pm,RESIDENTIAL FIRE ALARM (SINGLE FAMILY RESD/ MOBILE HOME),8500 BLOCK INSPIRATION AVE,Units: E111,05/23/2024,2024-05-23 17:32:00
6:01 pm,RESIDENTIAL FIRE ALARM (SINGLE FAMILY RESD/ MOBILE HOME),2800 BLOCK IVY MEADOW CT,Radio: 9C Units: E232,05/23/2024,2024-05-23 18:01:00
6:57 pm,WIRES DOWN OR ARCING,ADAMSTOWN RD / NEW DESIGN RD,"Radio: 9C Units: BR205, FS14",05/23/2024,2024-05-23 18:57:00
6:55 pm,WIRES DOWN OR ARCING,"6700 BLOCK MANOR WOODS RD, DEWEY JORDON",Radio: 9C Units: PE311,05/23/2024,2024-05-23 18:55:00
6:52 pm,WIRES DOWN OR ARCING,ADAMSTOWN RD / NEW DESIGN RD,Radio: 9C Units: BR145,05/23/2024,2024-05-23 18:52:00
6:51 pm,WIRES DOWN OR ARCING,3700 BLOCK POINT OF ROCKS RD,Radio: 9C Units: BR285,05/23/2024,2024-05-23 18:51:00
6:50 pm,WIRES DOWN OR ARCING,DOUBS RD / NEW DESIGN RD,Radio: 9C Units: BR145,05/23/2024,2024-05-23 18:50:00
7:02 pm,RESIDENTIAL FIRE ALARM (SINGLE FAMILY RESD/ MOBILE HOME),4300 BLOCK REELS MILL RD,Radio: 9C Units: E232,05/23/2024,2024-05-23 19:02:00
7:01 pm,WIRES DOWN OR ARCING,2300 BLOCK PLEASANT VIEW RD,"Radio: 9C Units: BR145, E201",05/23/2024,2024-05-23 19:01:00
7:46 pm,VEHICLE ACCIDENT - BLS,"1500 BLOCK W PATRICK ST, SEVEN ELEVEN OLD CAMP",Radio: 9B Units: E121,05/23/2024,2024-05-23 19:46:00
8:03 pm,WIRES DOWN OR ARCING,6700 BLOCK MANOR WOODS RD,"Units: BR145, FS14",05/23/2024,2024-05-23 20:03:00
7:53 pm,WIRES DOWN OR ARCING,4700 BLOCK TUSCARORA RD,Radio: 9C Units: BR145,05/23/2024,2024-05-23 19:53:00
7:52 pm,WIRES DOWN OR ARCING,4700 BLOCK TUSCARORA RD,Radio: 9C Units: BR285,05/23/2024,2024-05-23 19:52:00
8:06 pm,WIRES DOWN OR ARCING,6700 BLOCK MANOR WOODS RD,Units: E141,05/23/2024,2024-05-23 20:06:00
8:44 pm,WIRES DOWN OR ARCING,"1900 BLOCK BALLENGER CREEK PIKE, SAINT PAULS EPISCOPAL CHURCH","Radio: 9C Units: BR205, FS28",05/23/2024,2024-05-23 20:44:00
11:18 pm,MUTUAL AID,8700 BLOCK GUE RD,Units: E251,05/23/2024,2024-05-23 23:18:00
11:15 pm,MUTUAL AID,8700 BLOCK GUE RD,Units: A259,05/23/2024,2024-05-23 23:15:00
1:08 am,SHOOTING,200 BLOCK N MARKET ST,"Radio: 9D Units: A38, ALS4, E31, BC901, EMS901",05/24/2024,2024-05-24 01:08:00
3:02 am,VEHICLE ACCIDENT - BLS,N MAIN ST / COPPERMINE RD,"Radio: 9B Units: A169, E162",05/24/2024,2024-05-24 03:02:00
6:08 am,COMMERCIAL FIRE ALARM,"8700 BLOCK GAS HOUSE PIKE, ALDI FOODS DISTRIBUTION CENTER","Radio: 9C Units: PE23, TW4",05/24/2024,2024-05-24 06:08:00
8:13 am,ELECTRICAL HAZARD INSIDE,"400 BLOCK N MAPLE AVE, Apt/Unit:A",Radio: 9C Units: T5,05/24/2024,2024-05-24 08:13:00
8:12 am,VEHICLE ACCIDENT - ROLLOVER,"RT15-340WB / RT15 (FREDERICK), RT340EB / RT180","Radio: 9D Units: PE311, E31, R2, A319, A39, ALS4, BC902, EMS901",05/24/2024,2024-05-24 08:12:00
8:29 am,ELECTRICAL HAZARD - INVESTIGATION,8500 BLOCK FINGERBOARD RD,Radio: 9C Units: E232,05/24/2024,2024-05-24 08:29:00
8:22 am,VEHICLE ACCIDENT - ROLLOVER,"RT340WB / ELMER RD, RT340WB / ELMER RD",Radio: 9D Units: CMD3,05/24/2024,2024-05-24 08:22:00
9:38 am,UNKNOWN ODOR INSIDE,6500 BLOCK WHITE MULBERRY LN,"Radio: 9C Units: PE311, E11, R2",05/24/2024,2024-05-24 09:38:00
9:36 am,COMMERCIAL FIRE ALARM,3000 BLOCK VENTRIE CT,"Radio: 9C Units: E82, TW4",05/24/2024,2024-05-24 09:36:00
11:00 am,OUTSIDE FIRE,MONOCACY BLVD / E SOUTH ST,Radio: 9C Units: BC901,05/24/2024,2024-05-24 11:00:00
10:58 am,OUTSIDE FIRE,MONOCACY BLVD / S EAST ST,Radio: 9C Units: E31,05/24/2024,2024-05-24 10:58:00
11:38 am,MOTORCYCLE ACCIDENT,"RT15SB / S SETON AVE, RT15SB / S SETON AVE",Radio: 9D Units: CMD6,05/24/2024,2024-05-24 11:38:00
11:34 am,MOTORCYCLE ACCIDENT,"RT15SB / S SETON AVE, RT15SB / S SETON AVE",Radio: 9D Units: EK64,05/24/2024,2024-05-24 11:34:00
11:32 am,MOTORCYCLE ACCIDENT,"RT15SB / S SETON AVE, RT15SB / S SETON AVE",Radio: 9D Units: BC902,05/24/2024,2024-05-24 11:32:00
11:30 am,MOTORCYCLE ACCIDENT,"RT15SB / S SETON AVE, RT15SB / S SETON AVE","Radio: 9D Units: A69, ALS30, E61, EMS902",05/24/2024,2024-05-24 11:30:00
11:41 am,HELICOPTER LANDING ZONE,"16800 BLOCK S SETON AVE, NATIONAL EMERGENCY TRAINING CENTER",Radio: 9D Units: E102,05/24/2024,2024-05-24 11:41:00
1:35 pm,GAS LEAK INSIDE,3900 BLOCK SWEET BRIAR LN,"Units: E232, E251",05/24/2024,2024-05-24 13:35:00
1:42 pm,GAS LEAK INSIDE,3900 BLOCK SWEET BRIAR LN,Units: CMD23,05/24/2024,2024-05-24 13:42:00
1:56 pm,BRUSH FIRE,MEETING HOUSE RD / WOLFSVILLE RD,Units: BR216,05/24/2024,2024-05-24 13:56:00
2:06 pm,BRUSH FIRE,MEETING HOUSE RD / WOLFSVILLE RD,Units: BR216,05/24/2024,2024-05-24 14:06:00
2:02 pm,BRUSH FIRE,MEETING HOUSE RD / WOLFSVILLE RD,Units: E82,05/24/2024,2024-05-24 14:02:00
2:01 pm,BRUSH FIRE,MEETING HOUSE RD / WOLFSVILLE RD,Units: BR85,05/24/2024,2024-05-24 14:01:00
2:38 pm,BUILDING FIRE,W SOUTH ST / BROADWAY ST,"Units: E31, PE23, E11, PE311, E501, R2, TW4, A38, ALS4, BC901, SAF901",05/24/2024,2024-05-24 14:38:00
2:41 pm,BUILDING FIRE,W SOUTH ST / BROADWAY ST,Units: CMD3,05/24/2024,2024-05-24 14:41:00
2:40 pm,BUILDING FIRE,W SOUTH ST / BROADWAY ST,"Units: RID, E331, R20, A29, EMS902, W3",05/24/2024,2024-05-24 14:40:00
2:59 pm,UNIT TRANSFER TO OTHER STATION,"100 BLOCK THOMAS JOHNSON DR, STATION 29",Units: E61,05/24/2024,2024-05-24 14:59:00
2:59 pm,UNIT TRANSFER TO OTHER STATION,"100 BLOCK THOMAS JOHNSON DR, STATION 29",Units: R10,05/24/2024,2024-05-24 14:59:00
2:58 pm,UNIT TRANSFER TO OTHER STATION,"100 BLOCK S MARKET ST, STATION 3",Units: A159,05/24/2024,2024-05-24 14:58:00
2:56 pm,UNIT TRANSFER TO OTHER STATION,"300 BLOCK BAUGHMANS LN, STATION 31",Units: E121,05/24/2024,2024-05-24 14:56:00
2:51 pm,BUILDING FIRE,"100 BLOCK W SOUTH ST, SOUTH STREET SCHOOL APTS","Units: E291, E111, R15, CAN1, W3",05/24/2024,2024-05-24 14:51:00
3:20 pm,BUILDING FIRE,"100 BLOCK W SOUTH ST, SOUTH STREET SCHOOL APTS","Units: E121, EK114",05/24/2024,2024-05-24 15:20:00
3:33 pm,CHECK UP AFTER ACCIDENT - POLICE ON SCENE,BOYERS MILL RD / PINEHURST DR,"Units: A339, RE171, FS15",05/24/2024,2024-05-24 15:33:00
3:47 pm,VEHICLE FIRE,11100 BLOCK HESSONG BRIDGE RD,"Units: E61, E221",05/24/2024,2024-05-24 15:47:00
3:39 pm,CHECK UP AFTER ACCIDENT - POLICE ON SCENE,BOYERS MILL RD / PINEHURST DR,Units: A158,05/24/2024,2024-05-24 15:39:00
4:35 pm,SERVICE CALL,"POINT OF ROCKS BOAT RAMP, POINT OF ROCKS BOAT RAMP",Units: BT28,05/24/2024,2024-05-24 16:35:00
4:34 pm,SERVICE CALL,"POINT OF ROCKS BOAT RAMP, POINT OF ROCKS BOAT RAMP",Units: E281,05/24/2024,2024-05-24 16:34:00
5:19 pm,APPLIANCE FIRE CONTAINED,"6600 BLOCK ENGLISH MUFFIN WAY, SPRING ARBOR LIVING",Units: U14,05/24/2024,2024-05-24 17:19:00
5:17 pm,APPLIANCE FIRE CONTAINED,"6600 BLOCK ENGLISH MUFFIN WAY, SPRING ARBOR LIVING",Units: E141,05/24/2024,2024-05-24 17:17:00
5:13 pm,COMMERCIAL FIRE ALARM,"6600 BLOCK ENGLISH MUFFIN WAY, SPRING ARBOR LIVING",Units: E51,05/24/2024,2024-05-24 17:13:00
5:22 pm,COMMERCIAL FIRE ALARM,"6800 BLOCK ENGLISH MUFFIN WAY, UNITED RENTALS","Units: HCE41, T5, FS31",05/24/2024,2024-05-24 17:22:00
5:52 pm,MUTUAL AID,"I70WB / 38MM, BYPASSED TO: STATION 8,301 MAIN ST,MYERSVILLE",Units: E82,05/24/2024,2024-05-24 17:52:00
6:02 pm,ATV ACCIDENT,5700 BLOCK KENT DR,Units: R15,05/24/2024,2024-05-24 18:02:00
6:00 pm,ATV ACCIDENT,5700 BLOCK KENT DR,"Units: E251, RE171, A259, ALS2, BC901, EMS900, FS15",05/24/2024,2024-05-24 18:00:00
7:42 pm,VEHICLE FIRE,"RT340WB / LANDER RD, RT340WB / LANDER RD","Radio: 9C Units: E11, E201",05/24/2024,2024-05-24 19:42:00
7:53 pm,COMMERCIAL FIRE ALARM,"100 BLOCK WAVERLEY DR, Apt/Unit:201, ELMWOOD TERRACE APTS","Radio: 9C Units: E11, TW4",05/24/2024,2024-05-24 19:53:00
10:10 pm,SERVICE CALL,"1500 BLOCK VOLUNTEER DR, STATION 5",Radio: 9C Units: RE52,05/24/2024,2024-05-24 22:10:00
10:32 pm,WIRES DOWN OR ARCING,10800 BLOCK DUBLIN RD,Units: E162,05/24/2024,2024-05-24 22:32:00
12:04 am,MUTUAL AID,I70WB / 37MM,Units: E82,05/25/2024,2024-05-25 00:04:00
12:19 am,VEHICLE ACCIDENT - BLS,"100 BLOCK N EAST ST, FREDERICK COFFEE COMPANY","Radio: 9B Units: A39, E31",05/25/2024,2024-05-25 00:19:00
12:23 am,VEHICLE ACCIDENT - ALS,"100 BLOCK N EAST ST, FREDERICK COFFEE COMPANY","Radio: 9B Units: ALS2, EMS901",05/25/2024,2024-05-25 00:23:00
1:58 am,VEHICLE ACCIDENT - BLS,"I70WB / 45MM, I70WB / 45MM","Units: E121, E72, R8, A89",05/25/2024,2024-05-25 01:58:00
2:43 am,COMMERCIAL FIRE ALARM,5200 BLOCK INTERCOASTAL DR,"Radio: 9C Units: E152, TW4",05/25/2024,2024-05-25 02:43:00
3:17 am,HOUSE FIRE,14300 BLOCK BUCHANAN TRL E,"Units: EK64, R10",05/25/2024,2024-05-25 03:17:00
6:22 am,COMMERCIAL FIRE ALARM,600 BLOCK W PATRICK ST,"Radio: 9C Units: E31, TW4",05/25/2024,2024-05-25 06:22:00
9:31 am,COMMERCIAL VEHICLE FIRE,"I70EB / RIDGE RD (BRADDOCK), I70EB / RIDGE RD","Radio: 9C Units: E82, E11",05/25/2024,2024-05-25 09:31:00
1:45 pm,FLOODING CONDITION,"100 BLOCK E GREEN ST, MIDDLETOWN LIBRARY",Radio: 9C Units: RE74,05/25/2024,2024-05-25 13:45:00
3:39 pm,TRAIN FIRE INVESTIGATION,"7800 BLOCK WORMANS MILL RD, BEHIND","Radio: 9C Units: PE23, BR16, FS29",05/25/2024,2024-05-25 15:39:00
4:17 pm,WOODS FIRE THREATENING A STRUCTURE,200 BLOCK SOLAR DR,Radio: 9D Units: E91,05/25/2024,2024-05-25 16:17:00
4:14 pm,WOODS FIRE THREATENING A STRUCTURE,200 BLOCK SOLAR DR,"Radio: 9D Units: E111, E162, E291, Q11, BR116, A249, BR96, BC902, SAF901",05/25/2024,2024-05-25 16:14:00
6:46 pm,MOUNTAIN RESCUE,"WILLIAM HOUCK AREA, WILLIAM HOUCK AREA","Units: E221, E61, E132, R10, E102, TR29, EMSUTV30, A309, E212, BC902, SAF901, EMS901, FS10",05/25/2024,2024-05-25 18:46:00
6:43 pm,COMMERCIAL FIRE ALARM,"2400 BLOCK PLEASANT VIEW RD, Apt/Unit:3, SHORESH DAY CAMP",Radio: 9C Units: E141,05/25/2024,2024-05-25 18:43:00
6:59 pm,MOUNTAIN RESCUE,"WILLIAM HOUCK AREA, WILLIAM HOUCK AREA",Units: CMD10,05/25/2024,2024-05-25 18:59:00
6:51 pm,MOUNTAIN RESCUE,"WILLIAM HOUCK AREA, WILLIAM HOUCK AREA",Units: U13,05/25/2024,2024-05-25 18:51:00
7:44 pm,VEHICLE ACCIDENT - ROLLOVER,"I70EB / REST AREA (MYERSVILLE)(MYERSVILLE), I70WB / REST AREA","Radio: 9D Units: E82, A89, A78, ALS8, BC901, EMS902, FS08",05/25/2024,2024-05-25 19:44:00
8:03 pm,WIRES DOWN OR ARCING,NEW DESIGN RD / OLAND RD,Radio: 9C Units: BR145,05/25/2024,2024-05-25 20:03:00
8:01 pm,BRUSH FIRE,12500 BLOCK WOLFSVILLE RD,Units: BR216,05/25/2024,2024-05-25 20:01:00
7:51 pm,VEHICLE ACCIDENT - ROLLOVER,"I70EB / REST AREA (MYERSVILLE)(MYERSVILLE), I70WB / REST AREA",Radio: 9D Units: RE74,05/25/2024,2024-05-25 19:51:00
7:50 pm,VEHICLE ACCIDENT - ROLLOVER,"I70EB / REST AREA (MYERSVILLE)(MYERSVILLE), I70WB / REST AREA",Radio: 9D Units: E72,05/25/2024,2024-05-25 19:50:00
7:48 pm,VEHICLE ACCIDENT - ROLLOVER,"I70EB / REST AREA (MYERSVILLE)(MYERSVILLE), I70WB / REST AREA",Radio: 9D Units: R8,05/25/2024,2024-05-25 19:48:00
8:14 pm,COMMERCIAL FIRE ALARM,1000 BLOCK REAGANS RD,Radio: 9C Units: E291,05/25/2024,2024-05-25 20:14:00
8:04 pm,WIRES DOWN OR ARCING,NEW DESIGN RD / OLAND RD,Radio: 9C Units: E141,05/25/2024,2024-05-25 20:04:00
9:03 pm,HOUSE FIRE,100 BLOCK WEST BROADWAY ST,Units: E91,05/25/2024,2024-05-25 21:03:00
1:18 am,GAS LEAK INSIDE,"5300 BLOCK BUCKEYSTOWN PIKE, HAMPTON INN","Radio: 9C Units: PE311, E31, TW4",05/26/2024,2024-05-26 01:18:00
3:37 am,SHOOTING,200 BLOCK E CHURCH ST,"Radio: 9B Units: E31, BC901, EMS902",05/26/2024,2024-05-26 03:37:00
9:48 am,COMMERCIAL FIRE ALARM,"400 BLOCK PROSPECT BLVD, BEST WESTERN HOTEL","Radio: 9C Units: E31, TW4",05/26/2024,2024-05-26 09:48:00
9:58 am,COMMERCIAL FIRE ALARM,"6400 BLOCK JEFFERSON PIKE, TRANQUILITY AT FREDERICKTOWNE","Radio: 9C Units: E12, TW4",05/26/2024,2024-05-26 09:58:00
10:51 am,WIRES DOWN OR ARCING,"GREEN VALLEY RD / FINGERBOARD RD, WILCOMS INN",Radio: 9C Units: E251,05/26/2024,2024-05-26 10:51:00
11:17 am,VEHICLE ACCIDENT - ENTRAPMENT,WOODSBORO PIKE / DAYSVILLE RD,Radio: 9D Units: CMD11,05/26/2024,2024-05-26 11:17:00
11:13 am,VEHICLE ACCIDENT - ENTRAPMENT,DAYSVILLE AVE / WOODSBORO PIKE,"Radio: 9D Units: E111, R2, A249, ALS29, BC902, EMS902",05/26/2024,2024-05-26 11:13:00
12:07 pm,WIRES DOWN OR ARCING,BLACK ANKLE RD / TALBOT RUN RD,Radio: 9C Units: E172,05/26/2024,2024-05-26 12:07:00
12:04 pm,WIRES DOWN OR ARCING,BLACK ANKLE RD / TALBOT RUN RD,Radio: 9C Units: BR176,05/26/2024,2024-05-26 12:04:00
12:21 pm,RESIDENTIAL FIRE ALARM (SINGLE FAMILY RESD/ MOBILE HOME),3200 BLOCK HYDE PARK CT,Radio: 9C Units: E141,05/26/2024,2024-05-26 12:21:00
12:14 pm,COMMERCIAL FIRE ALARM,6300 BLOCK NEW HAVEN CT,"Radio: 9C Units: E311, TW4",05/26/2024,2024-05-26 12:14:00
1:16 pm,MOTORCYCLE ACCIDENT,URBANA PIKE / ARABY CHURCH RD,"Radio: 9D Units: A239, ALS23, E232, EMS901",05/26/2024,2024-05-26 13:16:00
1:36 pm,INVESTIGATION,"7800 BLOCK WORMANS MILL RD, WEGMANS","Radio: 9C Units: PE23, FS29",05/26/2024,2024-05-26 13:36:00
1:42 pm,INVESTIGATION,"7800 BLOCK WORMANS MILL RD, WEGMANS","Radio: 9C Units: PE23, FS29",05/26/2024,2024-05-26 13:42:00
1:54 pm,OUTSIDE FIRE,NEW DESIGN RD / LAUREL CT,Radio: 9C Units: E141,05/26/2024,2024-05-26 13:54:00
2:04 pm,VEHICLE ACCIDENT - BLS,NEW DESIGN RD / ROBIN DR,"Radio: 9B Units: E311, A39",05/26/2024,2024-05-26 14:04:00
5:02 pm,HELICOPTER LANDING ZONE,"16800 BLOCK S SETON AVE, NATIONAL EMERGENCY TRAINING CENTER",Radio: 9D Units: E61,05/26/2024,2024-05-26 17:02:00
6:20 pm,INVESTIGATION,REICHS FORD RD / MONOCACY RIVER,Radio: 9C Units: E31,05/26/2024,2024-05-26 18:20:00
6:20 pm,INVESTIGATION,REICHS FORD RD / MONOCACY RIVER,Radio: 9C Units: BR35,05/26/2024,2024-05-26 18:20:00
6:30 pm,INVESTIGATION,PINE BLUFF RD / EAGLES NEST RD,Units: E31,05/26/2024,2024-05-26 18:30:00
7:07 pm,ENTRAPMENT - TORSO OR HEAD,"2100 BLOCK OLD FARM DR, JIMMY MCGEE MEMORIAL PARK","Radio: 9D Units: E12, R2, A19, ALS2, SAF901, EMS902",05/26/2024,2024-05-26 19:07:00
7:46 pm,WIRES DOWN OR ARCING,7200 BLOCK(7500) BLK BLUE MOUNTAIN RD,Units: BR106,05/26/2024,2024-05-26 19:46:00
7:45 pm,WIRES DOWN OR ARCING,7200 BLOCK(7500) BLK BLUE MOUNTAIN RD,Units: E102,05/26/2024,2024-05-26 19:45:00
8:05 pm,VEHICLE ACCIDENT - BLS,"RT15SB / W SEVENTH ST, RT15SB / W SEVENTH ST","Units: PE23, E31, R2, A29, A39",05/26/2024,2024-05-26 20:05:00
10:43 pm,INVESTIGATION,BUTTERFLY LN / S MCCAIN DR,Radio: 9C Units: E12,05/26/2024,2024-05-26 22:43:00
11:59 pm,HOUSE FIRE,7900 BLOCK BLACK RD,Units: K22,05/26/2024,2024-05-26 23:59:00
11:54 pm,HOUSE FIRE,7900 BLOCK BLACK RD,"Units: E102, E61, E132, E221, E162, R10, R6, K10, EK64, EK224, A309, ALS30, BC902, BC901",05/26/2024,2024-05-26 23:54:00
12:10 am,HOUSE FIRE,7900 BLOCK BLACK RD,Units: K9,05/27/2024,2024-05-27 00:10:00
12:07 am,HOUSE FIRE,7900 BLOCK BLACK RD,"Units: E91, RE171",05/27/2024,2024-05-27 00:07:00
12:03 am,HOUSE FIRE,7900 BLOCK BLACK RD,"Units: TTF, EK224, EK134",05/27/2024,2024-05-27 00:03:00
12:03 am,HOUSE FIRE,7900 BLOCK BLACK RD,Units: CMD10,05/27/2024,2024-05-27 00:03:00
12:01 am,HOUSE FIRE,7900 BLOCK BLACK RD,"Units: RID2, A68, ACE232, EMS902, W10",05/27/2024,2024-05-27 00:01:00
12:22 am,UNIT TRANSFER TO OTHER STATION,"11100 BLOCK HESSONG BRIDGE RD, STATION 22",Units: K33,05/27/2024,2024-05-27 00:22:00
12:22 am,UNIT TRANSFER TO OTHER STATION,"11100 BLOCK HESSONG BRIDGE RD, STATION 22",Units: E152,05/27/2024,2024-05-27 00:22:00
12:24 am,UNIT TRANSFER TO OTHER STATION,"100 BLOCK N CHURCH ST, STATION 10","Units: E121, A38, K1",05/27/2024,2024-05-27 00:24:00
12:35 am,UNIT TRANSFER TO OTHER STATION,"11100 BLOCK HESSONG BRIDGE RD, STATION 22",Units: E201,05/27/2024,2024-05-27 00:35:00
12:45 am,UNIT TRANSFER TO OTHER STATION,"100 BLOCK N CHURCH ST, STATION 10",Units: A159,05/27/2024,2024-05-27 00:45:00
12:51 am,UNIT TRANSFER TO OTHER STATION,"100 BLOCK N CHURCH ST, STATION 10",Units: A158,05/27/2024,2024-05-27 00:51:00
1:56 am,INVESTIGATION,"16300 BLOCK GROTTO RD, NATIONAL SHRINE GROTTO OF OUR LADY OF LOURDES",Units: ACE22,05/27/2024,2024-05-27 01:56:00
2:27 am,PEDESTRIAN STRUCK,W PATRICK ST / HILLCREST DR,"Units: A19, ALS4, E12, EMS901",05/27/2024,2024-05-27 02:27:00
6:11 am,CHECK UP AFTER ACCIDENT - POLICE ON SCENE,"I70EB / HARMONY RD, I70EB / 39MM",Units: RE74,05/27/2024,2024-05-27 06:11:00
6:09 am,CHECK UP AFTER ACCIDENT - POLICE ON SCENE,"I70EB / HARMONY RD, I70EB / 39MM","Units: E72, E121, R8, A89",05/27/2024,2024-05-27 06:09:00
7:21 am,WIRES DOWN OR ARCING,1600 BLOCK SHOOKSTOWN RD,Units: E12,05/27/2024,2024-05-27 07:21:00
7:59 am,ENTRAPMENT - PERIPHERAL,11900 BLOCK SOUTH ST,"Units: E172, RE171, A179",05/27/2024,2024-05-27 07:59:00
11:23 am,FUEL SPILL,BURKITTSVILLE RD / LEES LN,Radio: 9C Units: RE52,05/27/2024,2024-05-27 11:23:00
1:35 pm,COMMERCIAL FIRE ALARM,100 BLOCK THOMAS JOHNSON DR,Radio: 9C Units: E291,05/27/2024,2024-05-27 13:35:00
2:11 pm,INVESTIGATION,LAUREL CT / NEW DESIGN RD,Radio: 9C Units: BR145,05/27/2024,2024-05-27 14:11:00
2:14 pm,RESIDENTIAL FIRE ALARM (SINGLE FAMILY RESD/ MOBILE HOME),100 BLOCK KEY PKWY,Radio: 9C Units: E12,05/27/2024,2024-05-27 14:14:00
2:12 pm,INVESTIGATION,LAUREL CT / NEW DESIGN RD,Radio: 9C Units: E141,05/27/2024,2024-05-27 14:12:00
2:12 pm,RESIDENTIAL FIRE ALARM (SINGLE FAMILY RESD/ MOBILE HOME),100 BLOCK KEY PKWY,Radio: 9C Units: E11,05/27/2024,2024-05-27 14:12:00
2:28 pm,ILLEGAL OPEN BURNING - NON EMERGENCY RESPONSE,VALLEY SIDE DR / AMBER DR,"Radio: 9C Units: PE23, FS29",05/27/2024,2024-05-27 14:28:00
5:20 pm,MOTORCYCLE ACCIDENT,"I70WB / 64MM, I70WB / 64MM",Units: CMD15,05/27/2024,2024-05-27 17:20:00
5:12 pm,MOTORCYCLE ACCIDENT,"I70WB / 64MM, I70WB / 64MM","Units: E331, R15, A339, EMS902, FS15",05/27/2024,2024-05-27 17:12:00
5:26 pm,COMMERCIAL FIRE ALARM,1000 BLOCK REAGANS RD,Radio: 9C Units: E291,05/27/2024,2024-05-27 17:26:00
5:37 pm,BUILDING FIRE,5200 BLOCK BAMBURG CT,Units: TW4,05/27/2024,2024-05-27 17:37:00
5:30 pm,BUILDING FIRE,5200 BLOCK BAMBURG CT,"Units: E311, E31, PE23, E12, E501, R2, TW4, A38, ALS2, BC902, SAF901, FS31",05/27/2024,2024-05-27 17:30:00
6:24 pm,BUILDING FIRE,100 BLOCK MILL AVE,Radio: CCA7 Units: E61,05/27/2024,2024-05-27 18:24:00
6:39 pm,UNIT TRANSFER TO OTHER STATION,"100 BLOCK E BALTIMORE ST, STATION CC005 - TANEYTOWN VFC",Radio: CCA1 Units: E132,05/27/2024,2024-05-27 18:39:00
6:53 pm,VEHICLE ACCIDENT - BLS,"5400 BLOCK SHOOKSTOWN RD, Apt/Unit:HTTPS://A91.IO/ZRE90","Radio: 9B Units: A18, E11",05/27/2024,2024-05-27 18:53:00
7:15 pm,COMMERCIAL FIRE ALARM,"5200 BLOCK PRESIDENTS CT, WINE DISTRICTS","Radio: 9C Units: PE311, TW4",05/27/2024,2024-05-27 19:15:00
9:05 pm,WIRES DOWN OR ARCING,10100 BLOCK HAMBURG RD,Radio: 9C Units: E82,05/27/2024,2024-05-27 21:05:00
9:02 pm,WIRES DOWN OR ARCING,10100 BLOCK HAMBURG RD,"Radio: 9C Units: BR85, FS29",05/27/2024,2024-05-27 21:02:00
10:40 pm,SERVICE CALL,BARTHOLOWS RD / BILL MOXLEY RD,Radio: 9C Units: E251,05/27/2024,2024-05-27 22:40:00
11:05 pm,VEHICLE ACCIDENT - ROLLOVER,"I270SB / BUCKEYSTOWN PIKE, I270SB / BUCKEYSTOWN PIKE","Radio: 9D Units: E12, E232, R2, A19, A239, ALS4, BC902, EMS901",05/27/2024,2024-05-27 23:05:00
1:28 am,COMMERCIAL FIRE ALARM,"2100 BLOCK WHITTIER DR, SOMERFORD PLACE",Units: E12,05/28/2024,2024-05-28 01:28:00
5:09 am,VEHICLE ACCIDENT - ALS,CRESTWOOD BLVD / NEW DESIGN RD,Radio: 9B Units: EMS901,05/28/2024,2024-05-28 05:09:00
5:06 am,CHECK UP AFTER ACCIDENT - POLICE ON SCENE,CRESTWOOD BLVD / NEW DESIGN RD,"Radio: 9B Units: A318, PE311",05/28/2024,2024-05-28 05:06:00
7:05 am,VEHICLE ACCIDENT - ROLLOVER,HOLLOW RD / OLD NATIONAL PIKE,"Radio: 9D Units: E121, RE74, ALS8, EMS901",05/28/2024,2024-05-28 07:05:00
9:40 am,COMMERCIAL FIRE ALARM,500 BLOCK SUGARBUSH CIR,"Units: E12, TW4",05/28/2024,2024-05-28 09:40:00
10:11 am,HAZARDOUS MATERIALS INCIDENT,"100 BLOCK COUNCIL DR, EASTERN MOBILITY COMPANY","Radio: 9D Units: E91, E111, RE171, HM33, E121, A169, A179, ALS29, BC901, SAF901, EMS902",05/28/2024,2024-05-28 10:11:00
10:16 am,HAZARDOUS MATERIALS INCIDENT,"100 BLOCK COUNCIL DR, EASTERN MOBILITY COMPANY",Radio: 9D Units: CMD16,05/28/2024,2024-05-28 10:16:00
10:14 am,VEHICLE ACCIDENT - BLS,"RT15NB / W PATRICK ST, RT15NB / W PATRICK ST","Units: E31, PE23, R2, A39, A29",05/28/2024,2024-05-28 10:14:00
10:25 am,HAZARDOUS MATERIALS INCIDENT,"100 BLOCK COUNCIL DR, EASTERN MOBILITY COMPANY",Radio: 9D Units: E162,05/28/2024,2024-05-28 10:25:00
10:31 am,MUTUAL AID,MD HEIGHTS RED TRAIL / SANDY HOOK RD,Units: RE52,05/28/2024,2024-05-28 10:31:00
11:10 am,COMMERCIAL FIRE ALARM,"300 BLOCK BAUGHMANS LN, DREAMERS COVE APTS",Radio: 9C Units: E12,05/28/2024,2024-05-28 11:10:00
11:08 am,COMMERCIAL FIRE ALARM,11100 BLOCK BALDWIN RD W,"Units: E152, TW4",05/28/2024,2024-05-28 11:08:00
11:20 am,WIRES DOWN OR ARCING,"9400 BLOCK FROSTOWN RD, IAO",Radio: 9C Units: BR85,05/28/2024,2024-05-28 11:20:00
11:22 am,WIRES DOWN OR ARCING,"9400 BLOCK FROSTOWN RD, IAO",Radio: 9C Units: E82,05/28/2024,2024-05-28 11:22:00
12:47 pm,VEHICLE ACCIDENT - BLS,N EAST ST / N MARKET ST,"Radio: 9B Units: A29, PE23",05/28/2024,2024-05-28 12:47:00
12:58 pm,RESIDENTIAL FIRE ALARM (SINGLE FAMILY RESD/ MOBILE HOME),200 BLOCK KNOTTY ALDER CT,Radio: 9C Units: E162,05/28/2024,2024-05-28 12:58:00
1:10 pm,VEHICLE ACCIDENT - BLS,"RT75 / ARTIE KEMP RD, RT75 / ARTIE KEMP RD",Radio: 9B Units: A159,05/28/2024,2024-05-28 13:10:00
1:08 pm,VEHICLE ACCIDENT - BLS,"RT75 / ARTIE KEMP RD, RT75 / ARTIE KEMP RD","Radio: 9B Units: A179, E172",05/28/2024,2024-05-28 13:08:00
1:27 pm,VEHICLE ACCIDENT - BLS,YELLOW SPRINGS RD / YANKEELAND AVE,"Radio: 9B Units: A18, E12",05/28/2024,2024-05-28 13:27:00
2:36 pm,GAS LEAK INSIDE,11800 BLOCK RENNER RD,"Radio: 9C Units: E91, E162, Q11, K9",05/28/2024,2024-05-28 14:36:00
2:59 pm,OUTSIDE FIRE,100 BLOCK E FOURTH ST,Radio: 9C Units: PE23,05/28/2024,2024-05-28 14:59:00
3:17 pm,VEHICLE ACCIDENT - BLS,BALTIMORE NATIONAL PIKE PIKE / BLENTLINGER RD,Units: E121,05/28/2024,2024-05-28 15:17:00
